<?xml version='1.0' encoding='UTF-8' ?>
<!DOCTYPE cldrTest SYSTEM '../common/dtd/cldrTest.dtd'>
<!-- For information, see readme.html -->
 <cldrTest version='1.8' base='lo'>
 <!-- Lao [ລາວ] -->
  <number 
locales='lo lo_LA'>
<!-- Lao [ລາວ@]; Lao (Laos) [ລາວ (ລາວ)@] -->
   <result input='0.0' numberType='integer' draft='unconfirmed approved'>0</result>
   <result numberType='decimal'>0</result>
   <result numberType='percent'>0%</result>
   <result numberType='scientific'>0E0</result>
   <result input='0.01' numberType='integer'>0</result>
   <result numberType='decimal'>0.01</result>
   <result numberType='percent'>1%</result>
   <result numberType='scientific'>1E-2</result>
   <result input='-0.01' numberType='integer'>-0</result>
   <result numberType='decimal'>-0.01</result>
   <result numberType='percent'>-1%</result>
   <result numberType='scientific'>-1E-2</result>
   <result input='1.0' numberType='integer'>1</result>
   <result numberType='decimal'>1</result>
   <result numberType='percent'>100%</result>
   <result numberType='scientific'>1E0</result>
   <result input='-1.0' numberType='integer'>-1</result>
   <result numberType='decimal'>-1</result>
   <result numberType='percent'>-100%</result>
   <result numberType='scientific'>-1E0</result>
   <result input='123.456' numberType='integer'>123</result>
   <result numberType='decimal'>123.456</result>
   <result numberType='percent'>12,346%</result>
   <result numberType='scientific'>1.23456E2</result>
   <result input='-123.456' numberType='integer'>-123</result>
   <result numberType='decimal'>-123.456</result>
   <result numberType='percent'>-12,346%</result>
   <result numberType='scientific'>-1.23456E2</result>
   <result input='123456.78' numberType='integer'>123,457</result>
   <result numberType='decimal'>123,456.78</result>
   <result numberType='percent'>12,345,678%</result>
   <result numberType='scientific'>1.2345678E5</result>
   <result input='-123456.78' numberType='integer'>-123,457</result>
   <result numberType='decimal'>-123,456.78</result>
   <result numberType='percent'>-12,345,678%</result>
   <result numberType='scientific'>-1.2345678E5</result>
   <result input='Infinity' numberType='integer'>∞</result>
   <result numberType='decimal'>∞</result>
   <result numberType='percent'>∞%</result>
   <result numberType='scientific'>∞</result>
   <result input='-Infinity' numberType='integer'>-∞</result>
   <result numberType='decimal'>-∞</result>
   <result numberType='percent'>-∞%</result>
   <result numberType='scientific'>-∞</result>
   <result input='NaN' numberType='integer'>NaN</result>
   <result numberType='decimal'>NaN</result>
   <result numberType='percent'>NaN</result>
   <result numberType='scientific'>NaN</result>
  </number>
  <date 
locales='lo lo_LA'>
<!-- Lao [ລາວ@]; Lao (Laos) [ລາວ (ລາວ)@] -->
   <result input='1900-01-31T00:00:00Z' dateType='none' timeType='short' draft='unconfirmed'>0:00</result>
   <result draft='approved'>00:00</result>
   <result timeType='medium' draft='unconfirmed'>0:00:00</result>
   <result draft='approved'>00:00:00</result>
   <result dateType='short' timeType='none' draft='unconfirmed'>31/1/1900</result>
   <result draft='approved'>1900-01-31</result>
   <result timeType='short' draft='unconfirmed'>31/1/1900, 0:00</result>
   <result draft='approved'>1900-01-31 00:00</result>
   <result timeType='medium' draft='unconfirmed'>31/1/1900, 0:00:00</result>
   <result draft='approved'>1900-01-31 00:00:00</result>
   <result dateType='medium' timeType='none' draft='unconfirmed'>31 ມ.ກ. 1900</result>
   <result draft='approved'>1900 1 31</result>
   <result timeType='short' draft='unconfirmed'>31 ມ.ກ. 1900, 0:00</result>
   <result draft='approved'>1900 1 31 00:00</result>
   <result timeType='medium' draft='unconfirmed'>31 ມ.ກ. 1900, 0:00:00</result>
   <result draft='approved'>1900 1 31 00:00:00</result>
   <result dateType='long' timeType='none' draft='unconfirmed'>31 ມັງກອນ 1900</result>
   <result draft='approved'>1900 1 31</result>
   <result timeType='short' draft='unconfirmed'>31 ມັງກອນ 1900, 0:00</result>
   <result draft='approved'>1900 1 31 00:00</result>
   <result timeType='medium' draft='unconfirmed'>31 ມັງກອນ 1900, 0:00:00</result>
   <result draft='approved'>1900 1 31 00:00:00</result>
   <result dateType='full' timeType='none' draft='unconfirmed'>ວັນພຸດທີ 31 ມັງກອນ ຄ.ສ. 1900</result>
   <result draft='approved'>4, 1900 1 31</result>
   <result timeType='short' draft='unconfirmed'>ວັນພຸດທີ 31 ມັງກອນ ຄ.ສ. 1900, 0:00</result>
   <result draft='approved'>4, 1900 1 31 00:00</result>
   <result timeType='medium' draft='unconfirmed'>ວັນພຸດທີ 31 ມັງກອນ ຄ.ສ. 1900, 0:00:00</result>
   <result draft='approved'>4, 1900 1 31 00:00:00</result>
   <result input='1909-02-28T00:00:01Z' dateType='none' timeType='short' draft='unconfirmed'>0:00</result>
   <result draft='approved'>00:00</result>
   <result timeType='medium' draft='unconfirmed'>0:00:01</result>
   <result draft='approved'>00:00:01</result>
   <result dateType='short' timeType='none' draft='unconfirmed'>28/2/1909</result>
   <result draft='approved'>1909-02-28</result>
   <result timeType='short' draft='unconfirmed'>28/2/1909, 0:00</result>
   <result draft='approved'>1909-02-28 00:00</result>
   <result timeType='medium' draft='unconfirmed'>28/2/1909, 0:00:01</result>
   <result draft='approved'>1909-02-28 00:00:01</result>
   <result dateType='medium' timeType='none' draft='unconfirmed'>28 ກ.ພ. 1909</result>
   <result draft='approved'>1909 2 28</result>
   <result timeType='short' draft='unconfirmed'>28 ກ.ພ. 1909, 0:00</result>
   <result draft='approved'>1909 2 28 00:00</result>
   <result timeType='medium' draft='unconfirmed'>28 ກ.ພ. 1909, 0:00:01</result>
   <result draft='approved'>1909 2 28 00:00:01</result>
   <result dateType='long' timeType='none' draft='unconfirmed'>28 ກຸມພາ 1909</result>
   <result draft='approved'>1909 2 28</result>
   <result timeType='short' draft='unconfirmed'>28 ກຸມພາ 1909, 0:00</result>
   <result draft='approved'>1909 2 28 00:00</result>
   <result timeType='medium' draft='unconfirmed'>28 ກຸມພາ 1909, 0:00:01</result>
   <result draft='approved'>1909 2 28 00:00:01</result>
   <result dateType='full' timeType='none' draft='unconfirmed'>ວັນອາທິດທີ 28 ກຸມພາ ຄ.ສ. 1909</result>
   <result draft='approved'>1, 1909 2 28</result>
   <result timeType='short' draft='unconfirmed'>ວັນອາທິດທີ 28 ກຸມພາ ຄ.ສ. 1909, 0:00</result>
   <result draft='approved'>1, 1909 2 28 00:00</result>
   <result timeType='medium' draft='unconfirmed'>ວັນອາທິດທີ 28 ກຸມພາ ຄ.ສ. 1909, 0:00:01</result>
   <result draft='approved'>1, 1909 2 28 00:00:01</result>
   <result input='1918-03-26T00:59:59Z' dateType='none' timeType='short' draft='unconfirmed'>0:59</result>
   <result draft='approved'>00:59</result>
   <result timeType='medium' draft='unconfirmed'>0:59:59</result>
   <result draft='approved'>00:59:59</result>
   <result dateType='short' timeType='none' draft='unconfirmed'>26/3/1918</result>
   <result draft='approved'>1918-03-26</result>
   <result timeType='short' draft='unconfirmed'>26/3/1918, 0:59</result>
   <result draft='approved'>1918-03-26 00:59</result>
   <result timeType='medium' draft='unconfirmed'>26/3/1918, 0:59:59</result>
   <result draft='approved'>1918-03-26 00:59:59</result>
   <result dateType='medium' timeType='none' draft='unconfirmed'>26 ມີ.ນ. 1918</result>
   <result draft='approved'>1918 3 26</result>
   <result timeType='short' draft='unconfirmed'>26 ມີ.ນ. 1918, 0:59</result>
   <result draft='approved'>1918 3 26 00:59</result>
   <result timeType='medium' draft='unconfirmed'>26 ມີ.ນ. 1918, 0:59:59</result>
   <result draft='approved'>1918 3 26 00:59:59</result>
   <result dateType='long' timeType='none' draft='unconfirmed'>26 ມີນາ 1918</result>
   <result draft='approved'>1918 3 26</result>
   <result timeType='short' draft='unconfirmed'>26 ມີນາ 1918, 0:59</result>
   <result draft='approved'>1918 3 26 00:59</result>
   <result timeType='medium' draft='unconfirmed'>26 ມີນາ 1918, 0:59:59</result>
   <result draft='approved'>1918 3 26 00:59:59</result>
   <result dateType='full' timeType='none' draft='unconfirmed'>ວັນອັງຄານທີ 26 ມີນາ ຄ.ສ. 1918</result>
   <result draft='approved'>3, 1918 3 26</result>
   <result timeType='short' draft='unconfirmed'>ວັນອັງຄານທີ 26 ມີນາ ຄ.ສ. 1918, 0:59</result>
   <result draft='approved'>3, 1918 3 26 00:59</result>
   <result timeType='medium' draft='unconfirmed'>ວັນອັງຄານທີ 26 ມີນາ ຄ.ສ. 1918, 0:59:59</result>
   <result draft='approved'>3, 1918 3 26 00:59:59</result>
   <result input='1932-04-24T01:00:00Z' dateType='none' timeType='short' draft='unconfirmed'>1:00</result>
   <result draft='approved'>01:00</result>
   <result timeType='medium' draft='unconfirmed'>1:00:00</result>
   <result draft='approved'>01:00:00</result>
   <result dateType='short' timeType='none' draft='unconfirmed'>24/4/1932</result>
   <result draft='approved'>1932-04-24</result>
   <result timeType='short' draft='unconfirmed'>24/4/1932, 1:00</result>
   <result draft='approved'>1932-04-24 01:00</result>
   <result timeType='medium' draft='unconfirmed'>24/4/1932, 1:00:00</result>
   <result draft='approved'>1932-04-24 01:00:00</result>
   <result dateType='medium' timeType='none' draft='unconfirmed'>24 ມ.ສ.. 1932</result>
   <result draft='approved'>1932 4 24</result>
   <result timeType='short' draft='unconfirmed'>24 ມ.ສ.. 1932, 1:00</result>
   <result draft='approved'>1932 4 24 01:00</result>
   <result timeType='medium' draft='unconfirmed'>24 ມ.ສ.. 1932, 1:00:00</result>
   <result draft='approved'>1932 4 24 01:00:00</result>
   <result dateType='long' timeType='none' draft='unconfirmed'>24 ເມສາ 1932</result>
   <result draft='approved'>1932 4 24</result>
   <result timeType='short' draft='unconfirmed'>24 ເມສາ 1932, 1:00</result>
   <result draft='approved'>1932 4 24 01:00</result>
   <result timeType='medium' draft='unconfirmed'>24 ເມສາ 1932, 1:00:00</result>
   <result draft='approved'>1932 4 24 01:00:00</result>
   <result dateType='full' timeType='none' draft='unconfirmed'>ວັນອາທິດທີ 24 ເມສາ ຄ.ສ. 1932</result>
   <result draft='approved'>1, 1932 4 24</result>
   <result timeType='short' draft='unconfirmed'>ວັນອາທິດທີ 24 ເມສາ ຄ.ສ. 1932, 1:00</result>
   <result draft='approved'>1, 1932 4 24 01:00</result>
   <result timeType='medium' draft='unconfirmed'>ວັນອາທິດທີ 24 ເມສາ ຄ.ສ. 1932, 1:00:00</result>
   <result draft='approved'>1, 1932 4 24 01:00:00</result>
   <result input='1945-05-20T01:00:01Z' dateType='none' timeType='short' draft='unconfirmed'>1:00</result>
   <result draft='approved'>01:00</result>
   <result timeType='medium' draft='unconfirmed'>1:00:01</result>
   <result draft='approved'>01:00:01</result>
   <result dateType='short' timeType='none' draft='unconfirmed'>20/5/1945</result>
   <result draft='approved'>1945-05-20</result>
   <result timeType='short' draft='unconfirmed'>20/5/1945, 1:00</result>
   <result draft='approved'>1945-05-20 01:00</result>
   <result timeType='medium' draft='unconfirmed'>20/5/1945, 1:00:01</result>
   <result draft='approved'>1945-05-20 01:00:01</result>
   <result dateType='medium' timeType='none' draft='unconfirmed'>20 ພ.ພ. 1945</result>
   <result draft='approved'>1945 5 20</result>
   <result timeType='short' draft='unconfirmed'>20 ພ.ພ. 1945, 1:00</result>
   <result draft='approved'>1945 5 20 01:00</result>
   <result timeType='medium' draft='unconfirmed'>20 ພ.ພ. 1945, 1:00:01</result>
   <result draft='approved'>1945 5 20 01:00:01</result>
   <result dateType='long' timeType='none' draft='unconfirmed'>20 ພຶດສະພາ 1945</result>
   <result draft='approved'>1945 5 20</result>
   <result timeType='short' draft='unconfirmed'>20 ພຶດສະພາ 1945, 1:00</result>
   <result draft='approved'>1945 5 20 01:00</result>
   <result timeType='medium' draft='unconfirmed'>20 ພຶດສະພາ 1945, 1:00:01</result>
   <result draft='approved'>1945 5 20 01:00:01</result>
   <result dateType='full' timeType='none' draft='unconfirmed'>ວັນອາທິດທີ 20 ພຶດສະພາ ຄ.ສ. 1945</result>
   <result draft='approved'>1, 1945 5 20</result>
   <result timeType='short' draft='unconfirmed'>ວັນອາທິດທີ 20 ພຶດສະພາ ຄ.ສ. 1945, 1:00</result>
   <result draft='approved'>1, 1945 5 20 01:00</result>
   <result timeType='medium' draft='unconfirmed'>ວັນອາທິດທີ 20 ພຶດສະພາ ຄ.ສ. 1945, 1:00:01</result>
   <result draft='approved'>1, 1945 5 20 01:00:01</result>
   <result input='1952-06-18T11:59:59Z' dateType='none' timeType='short' draft='unconfirmed approved'>11:59</result>
   <result timeType='medium'>11:59:59</result>
   <result dateType='short' timeType='none' draft='unconfirmed'>18/6/1952</result>
   <result draft='approved'>1952-06-18</result>
   <result timeType='short' draft='unconfirmed'>18/6/1952, 11:59</result>
   <result draft='approved'>1952-06-18 11:59</result>
   <result timeType='medium' draft='unconfirmed'>18/6/1952, 11:59:59</result>
   <result draft='approved'>1952-06-18 11:59:59</result>
   <result dateType='medium' timeType='none' draft='unconfirmed'>18 ມິ.ຖ. 1952</result>
   <result draft='approved'>1952 6 18</result>
   <result timeType='short' draft='unconfirmed'>18 ມິ.ຖ. 1952, 11:59</result>
   <result draft='approved'>1952 6 18 11:59</result>
   <result timeType='medium' draft='unconfirmed'>18 ມິ.ຖ. 1952, 11:59:59</result>
   <result draft='approved'>1952 6 18 11:59:59</result>
   <result dateType='long' timeType='none' draft='unconfirmed'>18 ມິຖຸນາ 1952</result>
   <result draft='approved'>1952 6 18</result>
   <result timeType='short' draft='unconfirmed'>18 ມິຖຸນາ 1952, 11:59</result>
   <result draft='approved'>1952 6 18 11:59</result>
   <result timeType='medium' draft='unconfirmed'>18 ມິຖຸນາ 1952, 11:59:59</result>
   <result draft='approved'>1952 6 18 11:59:59</result>
   <result dateType='full' timeType='none' draft='unconfirmed'>ວັນພຸດທີ 18 ມິຖຸນາ ຄ.ສ. 1952</result>
   <result draft='approved'>4, 1952 6 18</result>
   <result timeType='short' draft='unconfirmed'>ວັນພຸດທີ 18 ມິຖຸນາ ຄ.ສ. 1952, 11:59</result>
   <result draft='approved'>4, 1952 6 18 11:59</result>
   <result timeType='medium' draft='unconfirmed'>ວັນພຸດທີ 18 ມິຖຸນາ ຄ.ສ. 1952, 11:59:59</result>
   <result draft='approved'>4, 1952 6 18 11:59:59</result>
   <result input='1973-07-16T12:00:00Z' dateType='none' timeType='short' draft='unconfirmed approved'>12:00</result>
   <result timeType='medium'>12:00:00</result>
   <result dateType='short' timeType='none' draft='unconfirmed'>16/7/1973</result>
   <result draft='approved'>1973-07-16</result>
   <result timeType='short' draft='unconfirmed'>16/7/1973, 12:00</result>
   <result draft='approved'>1973-07-16 12:00</result>
   <result timeType='medium' draft='unconfirmed'>16/7/1973, 12:00:00</result>
   <result draft='approved'>1973-07-16 12:00:00</result>
   <result dateType='medium' timeType='none' draft='unconfirmed'>16 ກ.ລ. 1973</result>
   <result draft='approved'>1973 7 16</result>
   <result timeType='short' draft='unconfirmed'>16 ກ.ລ. 1973, 12:00</result>
   <result draft='approved'>1973 7 16 12:00</result>
   <result timeType='medium' draft='unconfirmed'>16 ກ.ລ. 1973, 12:00:00</result>
   <result draft='approved'>1973 7 16 12:00:00</result>
   <result dateType='long' timeType='none' draft='unconfirmed'>16 ກໍລະກົດ 1973</result>
   <result draft='approved'>1973 7 16</result>
   <result timeType='short' draft='unconfirmed'>16 ກໍລະກົດ 1973, 12:00</result>
   <result draft='approved'>1973 7 16 12:00</result>
   <result timeType='medium' draft='unconfirmed'>16 ກໍລະກົດ 1973, 12:00:00</result>
   <result draft='approved'>1973 7 16 12:00:00</result>
   <result dateType='full' timeType='none' draft='unconfirmed'>ວັນຈັນທີ 16 ກໍລະກົດ ຄ.ສ. 1973</result>
   <result draft='approved'>2, 1973 7 16</result>
   <result timeType='short' draft='unconfirmed'>ວັນຈັນທີ 16 ກໍລະກົດ ຄ.ສ. 1973, 12:00</result>
   <result draft='approved'>2, 1973 7 16 12:00</result>
   <result timeType='medium' draft='unconfirmed'>ວັນຈັນທີ 16 ກໍລະກົດ ຄ.ສ. 1973, 12:00:00</result>
   <result draft='approved'>2, 1973 7 16 12:00:00</result>
   <result input='1999-08-14T12:00:01Z' dateType='none' timeType='short' draft='unconfirmed approved'>12:00</result>
   <result timeType='medium'>12:00:01</result>
   <result dateType='short' timeType='none' draft='unconfirmed'>14/8/1999</result>
   <result draft='approved'>1999-08-14</result>
   <result timeType='short' draft='unconfirmed'>14/8/1999, 12:00</result>
   <result draft='approved'>1999-08-14 12:00</result>
   <result timeType='medium' draft='unconfirmed'>14/8/1999, 12:00:01</result>
   <result draft='approved'>1999-08-14 12:00:01</result>
   <result dateType='medium' timeType='none' draft='unconfirmed'>14 ສ.ຫ. 1999</result>
   <result draft='approved'>1999 8 14</result>
   <result timeType='short' draft='unconfirmed'>14 ສ.ຫ. 1999, 12:00</result>
   <result draft='approved'>1999 8 14 12:00</result>
   <result timeType='medium' draft='unconfirmed'>14 ສ.ຫ. 1999, 12:00:01</result>
   <result draft='approved'>1999 8 14 12:00:01</result>
   <result dateType='long' timeType='none' draft='unconfirmed'>14 ສິງຫາ 1999</result>
   <result draft='approved'>1999 8 14</result>
   <result timeType='short' draft='unconfirmed'>14 ສິງຫາ 1999, 12:00</result>
   <result draft='approved'>1999 8 14 12:00</result>
   <result timeType='medium' draft='unconfirmed'>14 ສິງຫາ 1999, 12:00:01</result>
   <result draft='approved'>1999 8 14 12:00:01</result>
   <result dateType='full' timeType='none' draft='unconfirmed'>ວັນເສົາທີ 14 ສິງຫາ ຄ.ສ. 1999</result>
   <result draft='approved'>7, 1999 8 14</result>
   <result timeType='short' draft='unconfirmed'>ວັນເສົາທີ 14 ສິງຫາ ຄ.ສ. 1999, 12:00</result>
   <result draft='approved'>7, 1999 8 14 12:00</result>
   <result timeType='medium' draft='unconfirmed'>ວັນເສົາທີ 14 ສິງຫາ ຄ.ສ. 1999, 12:00:01</result>
   <result draft='approved'>7, 1999 8 14 12:00:01</result>
   <result input='2000-09-12T22:59:59Z' dateType='none' timeType='short' draft='unconfirmed approved'>22:59</result>
   <result timeType='medium'>22:59:59</result>
   <result dateType='short' timeType='none' draft='unconfirmed'>12/9/2000</result>
   <result draft='approved'>2000-09-12</result>
   <result timeType='short' draft='unconfirmed'>12/9/2000, 22:59</result>
   <result draft='approved'>2000-09-12 22:59</result>
   <result timeType='medium' draft='unconfirmed'>12/9/2000, 22:59:59</result>
   <result draft='approved'>2000-09-12 22:59:59</result>
   <result dateType='medium' timeType='none' draft='unconfirmed'>12 ກ.ຍ. 2000</result>
   <result draft='approved'>2000 9 12</result>
   <result timeType='short' draft='unconfirmed'>12 ກ.ຍ. 2000, 22:59</result>
   <result draft='approved'>2000 9 12 22:59</result>
   <result timeType='medium' draft='unconfirmed'>12 ກ.ຍ. 2000, 22:59:59</result>
   <result draft='approved'>2000 9 12 22:59:59</result>
   <result dateType='long' timeType='none' draft='unconfirmed'>12 ກັນຍາ 2000</result>
   <result draft='approved'>2000 9 12</result>
   <result timeType='short' draft='unconfirmed'>12 ກັນຍາ 2000, 22:59</result>
   <result draft='approved'>2000 9 12 22:59</result>
   <result timeType='medium' draft='unconfirmed'>12 ກັນຍາ 2000, 22:59:59</result>
   <result draft='approved'>2000 9 12 22:59:59</result>
   <result dateType='full' timeType='none' draft='unconfirmed'>ວັນອັງຄານທີ 12 ກັນຍາ ຄ.ສ. 2000</result>
   <result draft='approved'>3, 2000 9 12</result>
   <result timeType='short' draft='unconfirmed'>ວັນອັງຄານທີ 12 ກັນຍາ ຄ.ສ. 2000, 22:59</result>
   <result draft='approved'>3, 2000 9 12 22:59</result>
   <result timeType='medium' draft='unconfirmed'>ວັນອັງຄານທີ 12 ກັນຍາ ຄ.ສ. 2000, 22:59:59</result>
   <result draft='approved'>3, 2000 9 12 22:59:59</result>
   <result input='2001-10-08T23:00:00Z' dateType='none' timeType='short' draft='unconfirmed approved'>23:00</result>
   <result timeType='medium'>23:00:00</result>
   <result dateType='short' timeType='none' draft='unconfirmed'>8/10/2001</result>
   <result draft='approved'>2001-10-08</result>
   <result timeType='short' draft='unconfirmed'>8/10/2001, 23:00</result>
   <result draft='approved'>2001-10-08 23:00</result>
   <result timeType='medium' draft='unconfirmed'>8/10/2001, 23:00:00</result>
   <result draft='approved'>2001-10-08 23:00:00</result>
   <result dateType='medium' timeType='none' draft='unconfirmed'>8 ຕ.ລ. 2001</result>
   <result draft='approved'>2001 10 8</result>
   <result timeType='short' draft='unconfirmed'>8 ຕ.ລ. 2001, 23:00</result>
   <result draft='approved'>2001 10 8 23:00</result>
   <result timeType='medium' draft='unconfirmed'>8 ຕ.ລ. 2001, 23:00:00</result>
   <result draft='approved'>2001 10 8 23:00:00</result>
   <result dateType='long' timeType='none' draft='unconfirmed'>8 ຕຸລາ 2001</result>
   <result draft='approved'>2001 10 8</result>
   <result timeType='short' draft='unconfirmed'>8 ຕຸລາ 2001, 23:00</result>
   <result draft='approved'>2001 10 8 23:00</result>
   <result timeType='medium' draft='unconfirmed'>8 ຕຸລາ 2001, 23:00:00</result>
   <result draft='approved'>2001 10 8 23:00:00</result>
   <result dateType='full' timeType='none' draft='unconfirmed'>ວັນຈັນທີ 8 ຕຸລາ ຄ.ສ. 2001</result>
   <result draft='approved'>2, 2001 10 08</result>
   <result timeType='short' draft='unconfirmed'>ວັນຈັນທີ 8 ຕຸລາ ຄ.ສ. 2001, 23:00</result>
   <result draft='approved'>2, 2001 10 08 23:00</result>
   <result timeType='medium' draft='unconfirmed'>ວັນຈັນທີ 8 ຕຸລາ ຄ.ສ. 2001, 23:00:00</result>
   <result draft='approved'>2, 2001 10 08 23:00:00</result>
   <result input='2004-11-04T23:00:01Z' dateType='none' timeType='short' draft='unconfirmed approved'>23:00</result>
   <result timeType='medium'>23:00:01</result>
   <result dateType='short' timeType='none' draft='unconfirmed'>4/11/2004</result>
   <result draft='approved'>2004-11-04</result>
   <result timeType='short' draft='unconfirmed'>4/11/2004, 23:00</result>
   <result draft='approved'>2004-11-04 23:00</result>
   <result timeType='medium' draft='unconfirmed'>4/11/2004, 23:00:01</result>
   <result draft='approved'>2004-11-04 23:00:01</result>
   <result dateType='medium' timeType='none' draft='unconfirmed'>4 ພ.ຈ. 2004</result>
   <result draft='approved'>2004 11 4</result>
   <result timeType='short' draft='unconfirmed'>4 ພ.ຈ. 2004, 23:00</result>
   <result draft='approved'>2004 11 4 23:00</result>
   <result timeType='medium' draft='unconfirmed'>4 ພ.ຈ. 2004, 23:00:01</result>
   <result draft='approved'>2004 11 4 23:00:01</result>
   <result dateType='long' timeType='none' draft='unconfirmed'>4 ພະຈິກ 2004</result>
   <result draft='approved'>2004 11 4</result>
   <result timeType='short' draft='unconfirmed'>4 ພະຈິກ 2004, 23:00</result>
   <result draft='approved'>2004 11 4 23:00</result>
   <result timeType='medium' draft='unconfirmed'>4 ພະຈິກ 2004, 23:00:01</result>
   <result draft='approved'>2004 11 4 23:00:01</result>
   <result dateType='full' timeType='none' draft='unconfirmed'>ວັນພະຫັດທີ 4 ພະຈິກ ຄ.ສ. 2004</result>
   <result draft='approved'>5, 2004 11 04</result>
   <result timeType='short' draft='unconfirmed'>ວັນພະຫັດທີ 4 ພະຈິກ ຄ.ສ. 2004, 23:00</result>
   <result draft='approved'>5, 2004 11 04 23:00</result>
   <result timeType='medium' draft='unconfirmed'>ວັນພະຫັດທີ 4 ພະຈິກ ຄ.ສ. 2004, 23:00:01</result>
   <result draft='approved'>5, 2004 11 04 23:00:01</result>
   <result input='2010-12-01T23:59:59Z' dateType='none' timeType='short' draft='unconfirmed approved'>23:59</result>
   <result timeType='medium'>23:59:59</result>
   <result dateType='short' timeType='none' draft='unconfirmed'>1/12/2010</result>
   <result draft='approved'>2010-12-01</result>
   <result timeType='short' draft='unconfirmed'>1/12/2010, 23:59</result>
   <result draft='approved'>2010-12-01 23:59</result>
   <result timeType='medium' draft='unconfirmed'>1/12/2010, 23:59:59</result>
   <result draft='approved'>2010-12-01 23:59:59</result>
   <result dateType='medium' timeType='none' draft='unconfirmed'>1 ທ.ວ. 2010</result>
   <result draft='approved'>2010 12 1</result>
   <result timeType='short' draft='unconfirmed'>1 ທ.ວ. 2010, 23:59</result>
   <result draft='approved'>2010 12 1 23:59</result>
   <result timeType='medium' draft='unconfirmed'>1 ທ.ວ. 2010, 23:59:59</result>
   <result draft='approved'>2010 12 1 23:59:59</result>
   <result dateType='long' timeType='none' draft='unconfirmed'>1 ທັນວາ 2010</result>
   <result draft='approved'>2010 12 1</result>
   <result timeType='short' draft='unconfirmed'>1 ທັນວາ 2010, 23:59</result>
   <result draft='approved'>2010 12 1 23:59</result>
   <result timeType='medium' draft='unconfirmed'>1 ທັນວາ 2010, 23:59:59</result>
   <result draft='approved'>2010 12 1 23:59:59</result>
   <result dateType='full' timeType='none' draft='unconfirmed'>ວັນພຸດທີ 1 ທັນວາ ຄ.ສ. 2010</result>
   <result draft='approved'>4, 2010 12 01</result>
   <result timeType='short' draft='unconfirmed'>ວັນພຸດທີ 1 ທັນວາ ຄ.ສ. 2010, 23:59</result>
   <result draft='approved'>4, 2010 12 01 23:59</result>
   <result timeType='medium' draft='unconfirmed'>ວັນພຸດທີ 1 ທັນວາ ຄ.ສ. 2010, 23:59:59</result>
   <result draft='approved'>4, 2010 12 01 23:59:59</result>
  </date>
  <zoneFields 
locales='lo lo_LA'>
<!-- Lao [ລາວ@]; Lao (Laos) [ລາວ (ລາວ)@] -->
  </zoneFields>
  <collation 
locales='lo lo_LA'>
<!-- Lao [ລາວ@]; Lao (Laos) [ລາວ (ລາວ)@] -->
   <result draft='unconfirmed approved'>
x​
X​
x່
X່
x້
X້
x໊
X໊
x໋
X໋
x໌
X໌
xໍ
Xໍ
x 
X 
x x
x.
X.
x.x
xໆ
Xໆ
xໆx
x0
X0
x໐
X໐
x0x
x໐x
x໑
X໑
x12
X12
x12x
x໑x
x2
X2
x໒
X໒
x2x
x໒x
x໓
X໓
x໓x
x໔
X໔
x໔x
x໕
X໕
x໕x
x໖
X໖
x໖x
x໗
X໗
x໗x
x໘
X໘
x໘x
x໙
X໙
x໙x
x​x
x່x
x້x
x໊x
x໋x
x໌x
xໍx
xກ
Xກ
xກx
xຂ
Xຂ
xຂx
xຄ
Xຄ
xຄx
xງ
Xງ
xງx
xຈ
Xຈ
xຈx
xສ
Xສ
xສx
xຊ
Xຊ
xຊx
xຍ
Xຍ
xຍx
xດ
Xດ
xດx
xຕ
Xຕ
xຕx
xຖ
Xຖ
xຖx
xທ
Xທ
xທx
xນ
Xນ
xນx
xບ
Xບ
xບx
xປ
Xປ
xປx
xຜ
Xຜ
xຜx
xຝ
Xຝ
xຝx
xພ
Xພ
xພx
xຟ
Xຟ
xຟx
xມ
Xມ
xມx
xຢ
Xຢ
xຢx
xຣ
Xຣ
xຣx
xລ
Xລ
xລx
xວ
Xວ
xວx
xຫ
Xຫ
xຫx
xໜ
Xໜ
xໜx
xໝ
Xໝ
xໝx
xອ
Xອ
xອx
xຮ
Xຮ
xຮx
xຯ
Xຯ
xຯx
xະ
Xະ
xະx
xັ
Xັ
xັx
xາ
Xາ
xາx
xຳ
Xຳ
xຳx
xິ
Xິ
xິx
xີ
Xີ
xີx
xຶ
Xຶ
xຶx
xື
Xື
xືx
xຸ
Xຸ
xຸx
xູ
Xູ
xູx
xົ
Xົ
xົx
xຼ
Xຼ
xຼx
xຽ
Xຽ
xຽx
xເ
Xເ
xເx
xແ
Xແ
xແx
xໂ
Xໂ
xໂx
xໃ
Xໃ
xໃx
xໄ
Xໄ
xໄx
</result>
  </collation>
 </cldrTest>
