<?xml version='1.0' encoding='UTF-8' ?>
<!DOCTYPE cldrTest SYSTEM '../common/dtd/cldrTest.dtd'>
<!-- For information, see readme.html -->
 <cldrTest version='1.8' base='ms'>
 <!-- Malay [Bahasa Melayu] -->
  <number 
locales='ms ms_MY'>
<!-- Malay [Bahasa Melayu@]; Malay (Malaysia) [Bahasa Melayu (Malaysia)@] -->
   <result input='0.0' numberType='integer' draft='unconfirmed approved'>0</result>
   <result numberType='decimal'>0</result>
   <result numberType='percent'>0%</result>
   <result numberType='scientific'>0E0</result>
   <result input='0.01' numberType='integer'>0</result>
   <result numberType='decimal'>0.01</result>
   <result numberType='percent'>1%</result>
   <result numberType='scientific'>1E-2</result>
   <result input='-0.01' numberType='integer'>-0</result>
   <result numberType='decimal'>-0.01</result>
   <result numberType='percent'>-1%</result>
   <result numberType='scientific'>-1E-2</result>
   <result input='1.0' numberType='integer'>1</result>
   <result numberType='decimal'>1</result>
   <result numberType='percent'>100%</result>
   <result numberType='scientific'>1E0</result>
   <result input='-1.0' numberType='integer'>-1</result>
   <result numberType='decimal'>-1</result>
   <result numberType='percent'>-100%</result>
   <result numberType='scientific'>-1E0</result>
   <result input='123.456' numberType='integer'>123</result>
   <result numberType='decimal'>123.456</result>
   <result numberType='percent'>12,346%</result>
   <result numberType='scientific'>1.23456E2</result>
   <result input='-123.456' numberType='integer'>-123</result>
   <result numberType='decimal'>-123.456</result>
   <result numberType='percent'>-12,346%</result>
   <result numberType='scientific'>-1.23456E2</result>
   <result input='123456.78' numberType='integer'>123,457</result>
   <result numberType='decimal'>123,456.78</result>
   <result numberType='percent'>12,345,678%</result>
   <result numberType='scientific'>1.2345678E5</result>
   <result input='-123456.78' numberType='integer'>-123,457</result>
   <result numberType='decimal'>-123,456.78</result>
   <result numberType='percent'>-12,345,678%</result>
   <result numberType='scientific'>-1.2345678E5</result>
   <result input='Infinity' numberType='integer'>∞</result>
   <result numberType='decimal'>∞</result>
   <result numberType='percent'>∞%</result>
   <result numberType='scientific'>∞</result>
   <result input='-Infinity' numberType='integer'>-∞</result>
   <result numberType='decimal'>-∞</result>
   <result numberType='percent'>-∞%</result>
   <result numberType='scientific'>-∞</result>
   <result input='NaN' numberType='integer'>NaN</result>
   <result numberType='decimal'>NaN</result>
   <result numberType='percent'>NaN</result>
   <result numberType='scientific'>NaN</result>
  </number>
  <number 
locales='ms_BN'>
<!-- Malay (Brunei) [Bahasa Melayu (Brunei)@] -->
   <result input='0.0' numberType='integer' draft='unconfirmed approved'>0</result>
   <result numberType='decimal'>0</result>
   <result numberType='percent'>0%</result>
   <result numberType='scientific'>0E0</result>
   <result input='0.01' numberType='integer'>0</result>
   <result numberType='decimal'>0,01</result>
   <result numberType='percent'>1%</result>
   <result numberType='scientific'>1E-2</result>
   <result input='-0.01' numberType='integer'>-0</result>
   <result numberType='decimal'>-0,01</result>
   <result numberType='percent'>-1%</result>
   <result numberType='scientific'>-1E-2</result>
   <result input='1.0' numberType='integer'>1</result>
   <result numberType='decimal'>1</result>
   <result numberType='percent'>100%</result>
   <result numberType='scientific'>1E0</result>
   <result input='-1.0' numberType='integer'>-1</result>
   <result numberType='decimal'>-1</result>
   <result numberType='percent'>-100%</result>
   <result numberType='scientific'>-1E0</result>
   <result input='123.456' numberType='integer'>123</result>
   <result numberType='decimal'>123,456</result>
   <result numberType='percent'>12.346%</result>
   <result numberType='scientific'>1,23456E2</result>
   <result input='-123.456' numberType='integer'>-123</result>
   <result numberType='decimal'>-123,456</result>
   <result numberType='percent'>-12.346%</result>
   <result numberType='scientific'>-1,23456E2</result>
   <result input='123456.78' numberType='integer'>123.457</result>
   <result numberType='decimal'>123.456,78</result>
   <result numberType='percent'>12.345.678%</result>
   <result numberType='scientific'>1,2345678E5</result>
   <result input='-123456.78' numberType='integer'>-123.457</result>
   <result numberType='decimal'>-123.456,78</result>
   <result numberType='percent'>-12.345.678%</result>
   <result numberType='scientific'>-1,2345678E5</result>
   <result input='Infinity' numberType='integer'>∞</result>
   <result numberType='decimal'>∞</result>
   <result numberType='percent'>∞%</result>
   <result numberType='scientific'>∞</result>
   <result input='-Infinity' numberType='integer'>-∞</result>
   <result numberType='decimal'>-∞</result>
   <result numberType='percent'>-∞%</result>
   <result numberType='scientific'>-∞</result>
   <result input='NaN' numberType='integer'>NaN</result>
   <result numberType='decimal'>NaN</result>
   <result numberType='percent'>NaN</result>
   <result numberType='scientific'>NaN</result>
  </number>
  <date 
locales='ms ms_MY'>
<!-- Malay [Bahasa Melayu@]; Malay (Malaysia) [Bahasa Melayu (Malaysia)@] -->
   <result input='1900-01-31T00:00:00Z' dateType='none' timeType='short' draft='unconfirmed'>12:00</result>
   <result draft='approved'>00:00</result>
   <result timeType='medium' draft='unconfirmed'>12:00:00 AM</result>
   <result draft='approved'>00:00:00</result>
   <result dateType='short' timeType='none' draft='unconfirmed'>31/01/1900</result>
   <result draft='approved'>1900-01-31</result>
   <result timeType='short' draft='unconfirmed'>31/01/1900 12:00</result>
   <result draft='approved'>1900-01-31 00:00</result>
   <result timeType='medium' draft='unconfirmed'>31/01/1900 12:00:00 AM</result>
   <result draft='approved'>1900-01-31 00:00:00</result>
   <result dateType='medium' timeType='none' draft='unconfirmed'>31 Jan 1900</result>
   <result draft='approved'>1900 Jan 31</result>
   <result timeType='short' draft='unconfirmed'>31 Jan 1900 12:00</result>
   <result draft='approved'>1900 Jan 31 00:00</result>
   <result timeType='medium' draft='unconfirmed'>31 Jan 1900 12:00:00 AM</result>
   <result draft='approved'>1900 Jan 31 00:00:00</result>
   <result dateType='long' timeType='none' draft='unconfirmed'>31 Januari 1900</result>
   <result draft='approved'>1900 Januari 31</result>
   <result timeType='short' draft='unconfirmed'>31 Januari 1900 12:00</result>
   <result draft='approved'>1900 Januari 31 00:00</result>
   <result timeType='medium' draft='unconfirmed'>31 Januari 1900 12:00:00 AM</result>
   <result draft='approved'>1900 Januari 31 00:00:00</result>
   <result dateType='full' timeType='none' draft='unconfirmed'>Rabu 31 Jan 1900</result>
   <result draft='approved'>Rabu, 1900 Januari 31</result>
   <result timeType='short' draft='unconfirmed'>Rabu 31 Jan 1900 12:00</result>
   <result draft='approved'>Rabu, 1900 Januari 31 00:00</result>
   <result timeType='medium' draft='unconfirmed'>Rabu 31 Jan 1900 12:00:00 AM</result>
   <result draft='approved'>Rabu, 1900 Januari 31 00:00:00</result>
   <result input='1909-02-28T00:00:01Z' dateType='none' timeType='short' draft='unconfirmed'>12:00</result>
   <result draft='approved'>00:00</result>
   <result timeType='medium' draft='unconfirmed'>12:00:01 AM</result>
   <result draft='approved'>00:00:01</result>
   <result dateType='short' timeType='none' draft='unconfirmed'>28/02/1909</result>
   <result draft='approved'>1909-02-28</result>
   <result timeType='short' draft='unconfirmed'>28/02/1909 12:00</result>
   <result draft='approved'>1909-02-28 00:00</result>
   <result timeType='medium' draft='unconfirmed'>28/02/1909 12:00:01 AM</result>
   <result draft='approved'>1909-02-28 00:00:01</result>
   <result dateType='medium' timeType='none' draft='unconfirmed'>28 Feb 1909</result>
   <result draft='approved'>1909 Feb 28</result>
   <result timeType='short' draft='unconfirmed'>28 Feb 1909 12:00</result>
   <result draft='approved'>1909 Feb 28 00:00</result>
   <result timeType='medium' draft='unconfirmed'>28 Feb 1909 12:00:01 AM</result>
   <result draft='approved'>1909 Feb 28 00:00:01</result>
   <result dateType='long' timeType='none' draft='unconfirmed'>28 Februari 1909</result>
   <result draft='approved'>1909 Februari 28</result>
   <result timeType='short' draft='unconfirmed'>28 Februari 1909 12:00</result>
   <result draft='approved'>1909 Februari 28 00:00</result>
   <result timeType='medium' draft='unconfirmed'>28 Februari 1909 12:00:01 AM</result>
   <result draft='approved'>1909 Februari 28 00:00:01</result>
   <result dateType='full' timeType='none' draft='unconfirmed'>Ahad 28 Feb 1909</result>
   <result draft='approved'>Ahad, 1909 Februari 28</result>
   <result timeType='short' draft='unconfirmed'>Ahad 28 Feb 1909 12:00</result>
   <result draft='approved'>Ahad, 1909 Februari 28 00:00</result>
   <result timeType='medium' draft='unconfirmed'>Ahad 28 Feb 1909 12:00:01 AM</result>
   <result draft='approved'>Ahad, 1909 Februari 28 00:00:01</result>
   <result input='1918-03-26T00:59:59Z' dateType='none' timeType='short' draft='unconfirmed'>12:59</result>
   <result draft='approved'>00:59</result>
   <result timeType='medium' draft='unconfirmed'>12:59:59 AM</result>
   <result draft='approved'>00:59:59</result>
   <result dateType='short' timeType='none' draft='unconfirmed'>26/03/1918</result>
   <result draft='approved'>1918-03-26</result>
   <result timeType='short' draft='unconfirmed'>26/03/1918 12:59</result>
   <result draft='approved'>1918-03-26 00:59</result>
   <result timeType='medium' draft='unconfirmed'>26/03/1918 12:59:59 AM</result>
   <result draft='approved'>1918-03-26 00:59:59</result>
   <result dateType='medium' timeType='none' draft='unconfirmed'>26 Mac 1918</result>
   <result draft='approved'>1918 Mac 26</result>
   <result timeType='short' draft='unconfirmed'>26 Mac 1918 12:59</result>
   <result draft='approved'>1918 Mac 26 00:59</result>
   <result timeType='medium' draft='unconfirmed'>26 Mac 1918 12:59:59 AM</result>
   <result draft='approved'>1918 Mac 26 00:59:59</result>
   <result dateType='long' timeType='none' draft='unconfirmed'>26 Mac 1918</result>
   <result draft='approved'>1918 Mac 26</result>
   <result timeType='short' draft='unconfirmed'>26 Mac 1918 12:59</result>
   <result draft='approved'>1918 Mac 26 00:59</result>
   <result timeType='medium' draft='unconfirmed'>26 Mac 1918 12:59:59 AM</result>
   <result draft='approved'>1918 Mac 26 00:59:59</result>
   <result dateType='full' timeType='none' draft='unconfirmed'>Selasa 26 Mac 1918</result>
   <result draft='approved'>Selasa, 1918 Mac 26</result>
   <result timeType='short' draft='unconfirmed'>Selasa 26 Mac 1918 12:59</result>
   <result draft='approved'>Selasa, 1918 Mac 26 00:59</result>
   <result timeType='medium' draft='unconfirmed'>Selasa 26 Mac 1918 12:59:59 AM</result>
   <result draft='approved'>Selasa, 1918 Mac 26 00:59:59</result>
   <result input='1932-04-24T01:00:00Z' dateType='none' timeType='short' draft='unconfirmed'>1:00</result>
   <result draft='approved'>01:00</result>
   <result timeType='medium' draft='unconfirmed'>1:00:00 AM</result>
   <result draft='approved'>01:00:00</result>
   <result dateType='short' timeType='none' draft='unconfirmed'>24/04/1932</result>
   <result draft='approved'>1932-04-24</result>
   <result timeType='short' draft='unconfirmed'>24/04/1932 1:00</result>
   <result draft='approved'>1932-04-24 01:00</result>
   <result timeType='medium' draft='unconfirmed'>24/04/1932 1:00:00 AM</result>
   <result draft='approved'>1932-04-24 01:00:00</result>
   <result dateType='medium' timeType='none' draft='unconfirmed'>24 Apr 1932</result>
   <result draft='approved'>1932 Apr 24</result>
   <result timeType='short' draft='unconfirmed'>24 Apr 1932 1:00</result>
   <result draft='approved'>1932 Apr 24 01:00</result>
   <result timeType='medium' draft='unconfirmed'>24 Apr 1932 1:00:00 AM</result>
   <result draft='approved'>1932 Apr 24 01:00:00</result>
   <result dateType='long' timeType='none' draft='unconfirmed'>24 April 1932</result>
   <result draft='approved'>1932 April 24</result>
   <result timeType='short' draft='unconfirmed'>24 April 1932 1:00</result>
   <result draft='approved'>1932 April 24 01:00</result>
   <result timeType='medium' draft='unconfirmed'>24 April 1932 1:00:00 AM</result>
   <result draft='approved'>1932 April 24 01:00:00</result>
   <result dateType='full' timeType='none' draft='unconfirmed'>Ahad 24 Apr 1932</result>
   <result draft='approved'>Ahad, 1932 April 24</result>
   <result timeType='short' draft='unconfirmed'>Ahad 24 Apr 1932 1:00</result>
   <result draft='approved'>Ahad, 1932 April 24 01:00</result>
   <result timeType='medium' draft='unconfirmed'>Ahad 24 Apr 1932 1:00:00 AM</result>
   <result draft='approved'>Ahad, 1932 April 24 01:00:00</result>
   <result input='1945-05-20T01:00:01Z' dateType='none' timeType='short' draft='unconfirmed'>1:00</result>
   <result draft='approved'>01:00</result>
   <result timeType='medium' draft='unconfirmed'>1:00:01 AM</result>
   <result draft='approved'>01:00:01</result>
   <result dateType='short' timeType='none' draft='unconfirmed'>20/05/1945</result>
   <result draft='approved'>1945-05-20</result>
   <result timeType='short' draft='unconfirmed'>20/05/1945 1:00</result>
   <result draft='approved'>1945-05-20 01:00</result>
   <result timeType='medium' draft='unconfirmed'>20/05/1945 1:00:01 AM</result>
   <result draft='approved'>1945-05-20 01:00:01</result>
   <result dateType='medium' timeType='none' draft='unconfirmed'>20 Mei 1945</result>
   <result draft='approved'>1945 Mei 20</result>
   <result timeType='short' draft='unconfirmed'>20 Mei 1945 1:00</result>
   <result draft='approved'>1945 Mei 20 01:00</result>
   <result timeType='medium' draft='unconfirmed'>20 Mei 1945 1:00:01 AM</result>
   <result draft='approved'>1945 Mei 20 01:00:01</result>
   <result dateType='long' timeType='none' draft='unconfirmed'>20 Mei 1945</result>
   <result draft='approved'>1945 Mei 20</result>
   <result timeType='short' draft='unconfirmed'>20 Mei 1945 1:00</result>
   <result draft='approved'>1945 Mei 20 01:00</result>
   <result timeType='medium' draft='unconfirmed'>20 Mei 1945 1:00:01 AM</result>
   <result draft='approved'>1945 Mei 20 01:00:01</result>
   <result dateType='full' timeType='none' draft='unconfirmed'>Ahad 20 Mei 1945</result>
   <result draft='approved'>Ahad, 1945 Mei 20</result>
   <result timeType='short' draft='unconfirmed'>Ahad 20 Mei 1945 1:00</result>
   <result draft='approved'>Ahad, 1945 Mei 20 01:00</result>
   <result timeType='medium' draft='unconfirmed'>Ahad 20 Mei 1945 1:00:01 AM</result>
   <result draft='approved'>Ahad, 1945 Mei 20 01:00:01</result>
   <result input='1952-06-18T11:59:59Z' dateType='none' timeType='short' draft='unconfirmed approved'>11:59</result>
   <result timeType='medium' draft='unconfirmed'>11:59:59 AM</result>
   <result draft='approved'>11:59:59</result>
   <result dateType='short' timeType='none' draft='unconfirmed'>18/06/1952</result>
   <result draft='approved'>1952-06-18</result>
   <result timeType='short' draft='unconfirmed'>18/06/1952 11:59</result>
   <result draft='approved'>1952-06-18 11:59</result>
   <result timeType='medium' draft='unconfirmed'>18/06/1952 11:59:59 AM</result>
   <result draft='approved'>1952-06-18 11:59:59</result>
   <result dateType='medium' timeType='none' draft='unconfirmed'>18 Jun 1952</result>
   <result draft='approved'>1952 Jun 18</result>
   <result timeType='short' draft='unconfirmed'>18 Jun 1952 11:59</result>
   <result draft='approved'>1952 Jun 18 11:59</result>
   <result timeType='medium' draft='unconfirmed'>18 Jun 1952 11:59:59 AM</result>
   <result draft='approved'>1952 Jun 18 11:59:59</result>
   <result dateType='long' timeType='none' draft='unconfirmed'>18 Jun 1952</result>
   <result draft='approved'>1952 Jun 18</result>
   <result timeType='short' draft='unconfirmed'>18 Jun 1952 11:59</result>
   <result draft='approved'>1952 Jun 18 11:59</result>
   <result timeType='medium' draft='unconfirmed'>18 Jun 1952 11:59:59 AM</result>
   <result draft='approved'>1952 Jun 18 11:59:59</result>
   <result dateType='full' timeType='none' draft='unconfirmed'>Rabu 18 Jun 1952</result>
   <result draft='approved'>Rabu, 1952 Jun 18</result>
   <result timeType='short' draft='unconfirmed'>Rabu 18 Jun 1952 11:59</result>
   <result draft='approved'>Rabu, 1952 Jun 18 11:59</result>
   <result timeType='medium' draft='unconfirmed'>Rabu 18 Jun 1952 11:59:59 AM</result>
   <result draft='approved'>Rabu, 1952 Jun 18 11:59:59</result>
   <result input='1973-07-16T12:00:00Z' dateType='none' timeType='short' draft='unconfirmed approved'>12:00</result>
   <result timeType='medium' draft='unconfirmed'>12:00:00 PM</result>
   <result draft='approved'>12:00:00</result>
   <result dateType='short' timeType='none' draft='unconfirmed'>16/07/1973</result>
   <result draft='approved'>1973-07-16</result>
   <result timeType='short' draft='unconfirmed'>16/07/1973 12:00</result>
   <result draft='approved'>1973-07-16 12:00</result>
   <result timeType='medium' draft='unconfirmed'>16/07/1973 12:00:00 PM</result>
   <result draft='approved'>1973-07-16 12:00:00</result>
   <result dateType='medium' timeType='none' draft='unconfirmed'>16 Jul 1973</result>
   <result draft='approved'>1973 Jul 16</result>
   <result timeType='short' draft='unconfirmed'>16 Jul 1973 12:00</result>
   <result draft='approved'>1973 Jul 16 12:00</result>
   <result timeType='medium' draft='unconfirmed'>16 Jul 1973 12:00:00 PM</result>
   <result draft='approved'>1973 Jul 16 12:00:00</result>
   <result dateType='long' timeType='none' draft='unconfirmed'>16 Julai 1973</result>
   <result draft='approved'>1973 Julai 16</result>
   <result timeType='short' draft='unconfirmed'>16 Julai 1973 12:00</result>
   <result draft='approved'>1973 Julai 16 12:00</result>
   <result timeType='medium' draft='unconfirmed'>16 Julai 1973 12:00:00 PM</result>
   <result draft='approved'>1973 Julai 16 12:00:00</result>
   <result dateType='full' timeType='none' draft='unconfirmed'>Isnin 16 Jul 1973</result>
   <result draft='approved'>Isnin, 1973 Julai 16</result>
   <result timeType='short' draft='unconfirmed'>Isnin 16 Jul 1973 12:00</result>
   <result draft='approved'>Isnin, 1973 Julai 16 12:00</result>
   <result timeType='medium' draft='unconfirmed'>Isnin 16 Jul 1973 12:00:00 PM</result>
   <result draft='approved'>Isnin, 1973 Julai 16 12:00:00</result>
   <result input='1999-08-14T12:00:01Z' dateType='none' timeType='short' draft='unconfirmed approved'>12:00</result>
   <result timeType='medium' draft='unconfirmed'>12:00:01 PM</result>
   <result draft='approved'>12:00:01</result>
   <result dateType='short' timeType='none' draft='unconfirmed'>14/08/1999</result>
   <result draft='approved'>1999-08-14</result>
   <result timeType='short' draft='unconfirmed'>14/08/1999 12:00</result>
   <result draft='approved'>1999-08-14 12:00</result>
   <result timeType='medium' draft='unconfirmed'>14/08/1999 12:00:01 PM</result>
   <result draft='approved'>1999-08-14 12:00:01</result>
   <result dateType='medium' timeType='none' draft='unconfirmed'>14 Ogos 1999</result>
   <result draft='approved'>1999 Ogos 14</result>
   <result timeType='short' draft='unconfirmed'>14 Ogos 1999 12:00</result>
   <result draft='approved'>1999 Ogos 14 12:00</result>
   <result timeType='medium' draft='unconfirmed'>14 Ogos 1999 12:00:01 PM</result>
   <result draft='approved'>1999 Ogos 14 12:00:01</result>
   <result dateType='long' timeType='none' draft='unconfirmed'>14 Ogos 1999</result>
   <result draft='approved'>1999 Ogos 14</result>
   <result timeType='short' draft='unconfirmed'>14 Ogos 1999 12:00</result>
   <result draft='approved'>1999 Ogos 14 12:00</result>
   <result timeType='medium' draft='unconfirmed'>14 Ogos 1999 12:00:01 PM</result>
   <result draft='approved'>1999 Ogos 14 12:00:01</result>
   <result dateType='full' timeType='none' draft='unconfirmed'>Sabtu 14 Ogos 1999</result>
   <result draft='approved'>Sabtu, 1999 Ogos 14</result>
   <result timeType='short' draft='unconfirmed'>Sabtu 14 Ogos 1999 12:00</result>
   <result draft='approved'>Sabtu, 1999 Ogos 14 12:00</result>
   <result timeType='medium' draft='unconfirmed'>Sabtu 14 Ogos 1999 12:00:01 PM</result>
   <result draft='approved'>Sabtu, 1999 Ogos 14 12:00:01</result>
   <result input='2000-09-12T22:59:59Z' dateType='none' timeType='short' draft='unconfirmed'>10:59</result>
   <result draft='approved'>22:59</result>
   <result timeType='medium' draft='unconfirmed'>10:59:59 PM</result>
   <result draft='approved'>22:59:59</result>
   <result dateType='short' timeType='none' draft='unconfirmed'>12/09/2000</result>
   <result draft='approved'>2000-09-12</result>
   <result timeType='short' draft='unconfirmed'>12/09/2000 10:59</result>
   <result draft='approved'>2000-09-12 22:59</result>
   <result timeType='medium' draft='unconfirmed'>12/09/2000 10:59:59 PM</result>
   <result draft='approved'>2000-09-12 22:59:59</result>
   <result dateType='medium' timeType='none' draft='unconfirmed'>12 Sep 2000</result>
   <result draft='approved'>2000 Sep 12</result>
   <result timeType='short' draft='unconfirmed'>12 Sep 2000 10:59</result>
   <result draft='approved'>2000 Sep 12 22:59</result>
   <result timeType='medium' draft='unconfirmed'>12 Sep 2000 10:59:59 PM</result>
   <result draft='approved'>2000 Sep 12 22:59:59</result>
   <result dateType='long' timeType='none' draft='unconfirmed'>12 September 2000</result>
   <result draft='approved'>2000 September 12</result>
   <result timeType='short' draft='unconfirmed'>12 September 2000 10:59</result>
   <result draft='approved'>2000 September 12 22:59</result>
   <result timeType='medium' draft='unconfirmed'>12 September 2000 10:59:59 PM</result>
   <result draft='approved'>2000 September 12 22:59:59</result>
   <result dateType='full' timeType='none' draft='unconfirmed'>Selasa 12 Sep 2000</result>
   <result draft='approved'>Selasa, 2000 September 12</result>
   <result timeType='short' draft='unconfirmed'>Selasa 12 Sep 2000 10:59</result>
   <result draft='approved'>Selasa, 2000 September 12 22:59</result>
   <result timeType='medium' draft='unconfirmed'>Selasa 12 Sep 2000 10:59:59 PM</result>
   <result draft='approved'>Selasa, 2000 September 12 22:59:59</result>
   <result input='2001-10-08T23:00:00Z' dateType='none' timeType='short' draft='unconfirmed'>11:00</result>
   <result draft='approved'>23:00</result>
   <result timeType='medium' draft='unconfirmed'>11:00:00 PM</result>
   <result draft='approved'>23:00:00</result>
   <result dateType='short' timeType='none' draft='unconfirmed'>08/10/2001</result>
   <result draft='approved'>2001-10-08</result>
   <result timeType='short' draft='unconfirmed'>08/10/2001 11:00</result>
   <result draft='approved'>2001-10-08 23:00</result>
   <result timeType='medium' draft='unconfirmed'>08/10/2001 11:00:00 PM</result>
   <result draft='approved'>2001-10-08 23:00:00</result>
   <result dateType='medium' timeType='none' draft='unconfirmed'>08 Okt 2001</result>
   <result draft='approved'>2001 Okt 8</result>
   <result timeType='short' draft='unconfirmed'>08 Okt 2001 11:00</result>
   <result draft='approved'>2001 Okt 8 23:00</result>
   <result timeType='medium' draft='unconfirmed'>08 Okt 2001 11:00:00 PM</result>
   <result draft='approved'>2001 Okt 8 23:00:00</result>
   <result dateType='long' timeType='none' draft='unconfirmed'>08 Oktober 2001</result>
   <result draft='approved'>2001 Oktober 8</result>
   <result timeType='short' draft='unconfirmed'>08 Oktober 2001 11:00</result>
   <result draft='approved'>2001 Oktober 8 23:00</result>
   <result timeType='medium' draft='unconfirmed'>08 Oktober 2001 11:00:00 PM</result>
   <result draft='approved'>2001 Oktober 8 23:00:00</result>
   <result dateType='full' timeType='none' draft='unconfirmed'>Isnin 08 Okt 2001</result>
   <result draft='approved'>Isnin, 2001 Oktober 08</result>
   <result timeType='short' draft='unconfirmed'>Isnin 08 Okt 2001 11:00</result>
   <result draft='approved'>Isnin, 2001 Oktober 08 23:00</result>
   <result timeType='medium' draft='unconfirmed'>Isnin 08 Okt 2001 11:00:00 PM</result>
   <result draft='approved'>Isnin, 2001 Oktober 08 23:00:00</result>
   <result input='2004-11-04T23:00:01Z' dateType='none' timeType='short' draft='unconfirmed'>11:00</result>
   <result draft='approved'>23:00</result>
   <result timeType='medium' draft='unconfirmed'>11:00:01 PM</result>
   <result draft='approved'>23:00:01</result>
   <result dateType='short' timeType='none' draft='unconfirmed'>04/11/2004</result>
   <result draft='approved'>2004-11-04</result>
   <result timeType='short' draft='unconfirmed'>04/11/2004 11:00</result>
   <result draft='approved'>2004-11-04 23:00</result>
   <result timeType='medium' draft='unconfirmed'>04/11/2004 11:00:01 PM</result>
   <result draft='approved'>2004-11-04 23:00:01</result>
   <result dateType='medium' timeType='none' draft='unconfirmed'>04 Nov 2004</result>
   <result draft='approved'>2004 Nov 4</result>
   <result timeType='short' draft='unconfirmed'>04 Nov 2004 11:00</result>
   <result draft='approved'>2004 Nov 4 23:00</result>
   <result timeType='medium' draft='unconfirmed'>04 Nov 2004 11:00:01 PM</result>
   <result draft='approved'>2004 Nov 4 23:00:01</result>
   <result dateType='long' timeType='none' draft='unconfirmed'>04 November 2004</result>
   <result draft='approved'>2004 November 4</result>
   <result timeType='short' draft='unconfirmed'>04 November 2004 11:00</result>
   <result draft='approved'>2004 November 4 23:00</result>
   <result timeType='medium' draft='unconfirmed'>04 November 2004 11:00:01 PM</result>
   <result draft='approved'>2004 November 4 23:00:01</result>
   <result dateType='full' timeType='none' draft='unconfirmed'>Khamis 04 Nov 2004</result>
   <result draft='approved'>Khamis, 2004 November 04</result>
   <result timeType='short' draft='unconfirmed'>Khamis 04 Nov 2004 11:00</result>
   <result draft='approved'>Khamis, 2004 November 04 23:00</result>
   <result timeType='medium' draft='unconfirmed'>Khamis 04 Nov 2004 11:00:01 PM</result>
   <result draft='approved'>Khamis, 2004 November 04 23:00:01</result>
   <result input='2010-12-01T23:59:59Z' dateType='none' timeType='short' draft='unconfirmed'>11:59</result>
   <result draft='approved'>23:59</result>
   <result timeType='medium' draft='unconfirmed'>11:59:59 PM</result>
   <result draft='approved'>23:59:59</result>
   <result dateType='short' timeType='none' draft='unconfirmed'>01/12/2010</result>
   <result draft='approved'>2010-12-01</result>
   <result timeType='short' draft='unconfirmed'>01/12/2010 11:59</result>
   <result draft='approved'>2010-12-01 23:59</result>
   <result timeType='medium' draft='unconfirmed'>01/12/2010 11:59:59 PM</result>
   <result draft='approved'>2010-12-01 23:59:59</result>
   <result dateType='medium' timeType='none' draft='unconfirmed'>01 Dis 2010</result>
   <result draft='approved'>2010 Dis 1</result>
   <result timeType='short' draft='unconfirmed'>01 Dis 2010 11:59</result>
   <result draft='approved'>2010 Dis 1 23:59</result>
   <result timeType='medium' draft='unconfirmed'>01 Dis 2010 11:59:59 PM</result>
   <result draft='approved'>2010 Dis 1 23:59:59</result>
   <result dateType='long' timeType='none' draft='unconfirmed'>01 Disember 2010</result>
   <result draft='approved'>2010 Disember 1</result>
   <result timeType='short' draft='unconfirmed'>01 Disember 2010 11:59</result>
   <result draft='approved'>2010 Disember 1 23:59</result>
   <result timeType='medium' draft='unconfirmed'>01 Disember 2010 11:59:59 PM</result>
   <result draft='approved'>2010 Disember 1 23:59:59</result>
   <result dateType='full' timeType='none' draft='unconfirmed'>Rabu 01 Dis 2010</result>
   <result draft='approved'>Rabu, 2010 Disember 01</result>
   <result timeType='short' draft='unconfirmed'>Rabu 01 Dis 2010 11:59</result>
   <result draft='approved'>Rabu, 2010 Disember 01 23:59</result>
   <result timeType='medium' draft='unconfirmed'>Rabu 01 Dis 2010 11:59:59 PM</result>
   <result draft='approved'>Rabu, 2010 Disember 01 23:59:59</result>
  </date>
  <date 
locales='ms_BN'>
<!-- Malay (Brunei) [Bahasa Melayu (Brunei)@] -->
   <result input='1900-01-31T00:00:00Z' dateType='none' timeType='short' draft='unconfirmed approved'>0:00</result>
   <result timeType='medium'>0:00:00</result>
   <result dateType='short' timeType='none' draft='unconfirmed'>31/01/1900</result>
   <result draft='approved'>1900-01-31</result>
   <result timeType='short' draft='unconfirmed'>31/01/1900 0:00</result>
   <result draft='approved'>1900-01-31 0:00</result>
   <result timeType='medium' draft='unconfirmed'>31/01/1900 0:00:00</result>
   <result draft='approved'>1900-01-31 0:00:00</result>
   <result dateType='medium' timeType='none' draft='unconfirmed approved'>31/01/1900</result>
   <result timeType='short'>31/01/1900 0:00</result>
   <result timeType='medium'>31/01/1900 0:00:00</result>
   <result dateType='long' timeType='none' draft='unconfirmed'>31 Januari 1900</result>
   <result draft='approved'>1900 Januari 31</result>
   <result timeType='short' draft='unconfirmed'>31 Januari 1900 0:00</result>
   <result draft='approved'>1900 Januari 31 0:00</result>
   <result timeType='medium' draft='unconfirmed'>31 Januari 1900 0:00:00</result>
   <result draft='approved'>1900 Januari 31 0:00:00</result>
   <result dateType='full' timeType='none' draft='unconfirmed approved'>31 Januari 1900</result>
   <result timeType='short'>31 Januari 1900 0:00</result>
   <result timeType='medium'>31 Januari 1900 0:00:00</result>
   <result input='1909-02-28T00:00:01Z' dateType='none' timeType='short'>0:00</result>
   <result timeType='medium'>0:00:01</result>
   <result dateType='short' timeType='none' draft='unconfirmed'>28/02/1909</result>
   <result draft='approved'>1909-02-28</result>
   <result timeType='short' draft='unconfirmed'>28/02/1909 0:00</result>
   <result draft='approved'>1909-02-28 0:00</result>
   <result timeType='medium' draft='unconfirmed'>28/02/1909 0:00:01</result>
   <result draft='approved'>1909-02-28 0:00:01</result>
   <result dateType='medium' timeType='none' draft='unconfirmed approved'>28/02/1909</result>
   <result timeType='short'>28/02/1909 0:00</result>
   <result timeType='medium'>28/02/1909 0:00:01</result>
   <result dateType='long' timeType='none' draft='unconfirmed'>28 Februari 1909</result>
   <result draft='approved'>1909 Februari 28</result>
   <result timeType='short' draft='unconfirmed'>28 Februari 1909 0:00</result>
   <result draft='approved'>1909 Februari 28 0:00</result>
   <result timeType='medium' draft='unconfirmed'>28 Februari 1909 0:00:01</result>
   <result draft='approved'>1909 Februari 28 0:00:01</result>
   <result dateType='full' timeType='none' draft='unconfirmed approved'>28 Februari 1909</result>
   <result timeType='short'>28 Februari 1909 0:00</result>
   <result timeType='medium'>28 Februari 1909 0:00:01</result>
   <result input='1918-03-26T00:59:59Z' dateType='none' timeType='short'>0:59</result>
   <result timeType='medium'>0:59:59</result>
   <result dateType='short' timeType='none' draft='unconfirmed'>26/03/1918</result>
   <result draft='approved'>1918-03-26</result>
   <result timeType='short' draft='unconfirmed'>26/03/1918 0:59</result>
   <result draft='approved'>1918-03-26 0:59</result>
   <result timeType='medium' draft='unconfirmed'>26/03/1918 0:59:59</result>
   <result draft='approved'>1918-03-26 0:59:59</result>
   <result dateType='medium' timeType='none' draft='unconfirmed approved'>26/03/1918</result>
   <result timeType='short'>26/03/1918 0:59</result>
   <result timeType='medium'>26/03/1918 0:59:59</result>
   <result dateType='long' timeType='none' draft='unconfirmed'>26 Mac 1918</result>
   <result draft='approved'>1918 Mac 26</result>
   <result timeType='short' draft='unconfirmed'>26 Mac 1918 0:59</result>
   <result draft='approved'>1918 Mac 26 0:59</result>
   <result timeType='medium' draft='unconfirmed'>26 Mac 1918 0:59:59</result>
   <result draft='approved'>1918 Mac 26 0:59:59</result>
   <result dateType='full' timeType='none' draft='unconfirmed approved'>26 Mac 1918</result>
   <result timeType='short'>26 Mac 1918 0:59</result>
   <result timeType='medium'>26 Mac 1918 0:59:59</result>
   <result input='1932-04-24T01:00:00Z' dateType='none' timeType='short'>1:00</result>
   <result timeType='medium'>1:00:00</result>
   <result dateType='short' timeType='none' draft='unconfirmed'>24/04/1932</result>
   <result draft='approved'>1932-04-24</result>
   <result timeType='short' draft='unconfirmed'>24/04/1932 1:00</result>
   <result draft='approved'>1932-04-24 1:00</result>
   <result timeType='medium' draft='unconfirmed'>24/04/1932 1:00:00</result>
   <result draft='approved'>1932-04-24 1:00:00</result>
   <result dateType='medium' timeType='none' draft='unconfirmed approved'>24/04/1932</result>
   <result timeType='short'>24/04/1932 1:00</result>
   <result timeType='medium'>24/04/1932 1:00:00</result>
   <result dateType='long' timeType='none' draft='unconfirmed'>24 April 1932</result>
   <result draft='approved'>1932 April 24</result>
   <result timeType='short' draft='unconfirmed'>24 April 1932 1:00</result>
   <result draft='approved'>1932 April 24 1:00</result>
   <result timeType='medium' draft='unconfirmed'>24 April 1932 1:00:00</result>
   <result draft='approved'>1932 April 24 1:00:00</result>
   <result dateType='full' timeType='none' draft='unconfirmed approved'>24 April 1932</result>
   <result timeType='short'>24 April 1932 1:00</result>
   <result timeType='medium'>24 April 1932 1:00:00</result>
   <result input='1945-05-20T01:00:01Z' dateType='none' timeType='short'>1:00</result>
   <result timeType='medium'>1:00:01</result>
   <result dateType='short' timeType='none' draft='unconfirmed'>20/05/1945</result>
   <result draft='approved'>1945-05-20</result>
   <result timeType='short' draft='unconfirmed'>20/05/1945 1:00</result>
   <result draft='approved'>1945-05-20 1:00</result>
   <result timeType='medium' draft='unconfirmed'>20/05/1945 1:00:01</result>
   <result draft='approved'>1945-05-20 1:00:01</result>
   <result dateType='medium' timeType='none' draft='unconfirmed approved'>20/05/1945</result>
   <result timeType='short'>20/05/1945 1:00</result>
   <result timeType='medium'>20/05/1945 1:00:01</result>
   <result dateType='long' timeType='none' draft='unconfirmed'>20 Mei 1945</result>
   <result draft='approved'>1945 Mei 20</result>
   <result timeType='short' draft='unconfirmed'>20 Mei 1945 1:00</result>
   <result draft='approved'>1945 Mei 20 1:00</result>
   <result timeType='medium' draft='unconfirmed'>20 Mei 1945 1:00:01</result>
   <result draft='approved'>1945 Mei 20 1:00:01</result>
   <result dateType='full' timeType='none' draft='unconfirmed approved'>20 Mei 1945</result>
   <result timeType='short'>20 Mei 1945 1:00</result>
   <result timeType='medium'>20 Mei 1945 1:00:01</result>
   <result input='1952-06-18T11:59:59Z' dateType='none' timeType='short'>11:59</result>
   <result timeType='medium'>11:59:59</result>
   <result dateType='short' timeType='none' draft='unconfirmed'>18/06/1952</result>
   <result draft='approved'>1952-06-18</result>
   <result timeType='short' draft='unconfirmed'>18/06/1952 11:59</result>
   <result draft='approved'>1952-06-18 11:59</result>
   <result timeType='medium' draft='unconfirmed'>18/06/1952 11:59:59</result>
   <result draft='approved'>1952-06-18 11:59:59</result>
   <result dateType='medium' timeType='none' draft='unconfirmed approved'>18/06/1952</result>
   <result timeType='short'>18/06/1952 11:59</result>
   <result timeType='medium'>18/06/1952 11:59:59</result>
   <result dateType='long' timeType='none' draft='unconfirmed'>18 Jun 1952</result>
   <result draft='approved'>1952 Jun 18</result>
   <result timeType='short' draft='unconfirmed'>18 Jun 1952 11:59</result>
   <result draft='approved'>1952 Jun 18 11:59</result>
   <result timeType='medium' draft='unconfirmed'>18 Jun 1952 11:59:59</result>
   <result draft='approved'>1952 Jun 18 11:59:59</result>
   <result dateType='full' timeType='none' draft='unconfirmed approved'>18 Jun 1952</result>
   <result timeType='short'>18 Jun 1952 11:59</result>
   <result timeType='medium'>18 Jun 1952 11:59:59</result>
   <result input='1973-07-16T12:00:00Z' dateType='none' timeType='short'>12:00</result>
   <result timeType='medium'>12:00:00</result>
   <result dateType='short' timeType='none' draft='unconfirmed'>16/07/1973</result>
   <result draft='approved'>1973-07-16</result>
   <result timeType='short' draft='unconfirmed'>16/07/1973 12:00</result>
   <result draft='approved'>1973-07-16 12:00</result>
   <result timeType='medium' draft='unconfirmed'>16/07/1973 12:00:00</result>
   <result draft='approved'>1973-07-16 12:00:00</result>
   <result dateType='medium' timeType='none' draft='unconfirmed approved'>16/07/1973</result>
   <result timeType='short'>16/07/1973 12:00</result>
   <result timeType='medium'>16/07/1973 12:00:00</result>
   <result dateType='long' timeType='none' draft='unconfirmed'>16 Julai 1973</result>
   <result draft='approved'>1973 Julai 16</result>
   <result timeType='short' draft='unconfirmed'>16 Julai 1973 12:00</result>
   <result draft='approved'>1973 Julai 16 12:00</result>
   <result timeType='medium' draft='unconfirmed'>16 Julai 1973 12:00:00</result>
   <result draft='approved'>1973 Julai 16 12:00:00</result>
   <result dateType='full' timeType='none' draft='unconfirmed approved'>16 Julai 1973</result>
   <result timeType='short'>16 Julai 1973 12:00</result>
   <result timeType='medium'>16 Julai 1973 12:00:00</result>
   <result input='1999-08-14T12:00:01Z' dateType='none' timeType='short'>12:00</result>
   <result timeType='medium'>12:00:01</result>
   <result dateType='short' timeType='none' draft='unconfirmed'>14/08/1999</result>
   <result draft='approved'>1999-08-14</result>
   <result timeType='short' draft='unconfirmed'>14/08/1999 12:00</result>
   <result draft='approved'>1999-08-14 12:00</result>
   <result timeType='medium' draft='unconfirmed'>14/08/1999 12:00:01</result>
   <result draft='approved'>1999-08-14 12:00:01</result>
   <result dateType='medium' timeType='none' draft='unconfirmed approved'>14/08/1999</result>
   <result timeType='short'>14/08/1999 12:00</result>
   <result timeType='medium'>14/08/1999 12:00:01</result>
   <result dateType='long' timeType='none' draft='unconfirmed'>14 Ogos 1999</result>
   <result draft='approved'>1999 Ogos 14</result>
   <result timeType='short' draft='unconfirmed'>14 Ogos 1999 12:00</result>
   <result draft='approved'>1999 Ogos 14 12:00</result>
   <result timeType='medium' draft='unconfirmed'>14 Ogos 1999 12:00:01</result>
   <result draft='approved'>1999 Ogos 14 12:00:01</result>
   <result dateType='full' timeType='none' draft='unconfirmed approved'>14 Ogos 1999</result>
   <result timeType='short'>14 Ogos 1999 12:00</result>
   <result timeType='medium'>14 Ogos 1999 12:00:01</result>
   <result input='2000-09-12T22:59:59Z' dateType='none' timeType='short'>22:59</result>
   <result timeType='medium'>22:59:59</result>
   <result dateType='short' timeType='none' draft='unconfirmed'>12/09/2000</result>
   <result draft='approved'>2000-09-12</result>
   <result timeType='short' draft='unconfirmed'>12/09/2000 22:59</result>
   <result draft='approved'>2000-09-12 22:59</result>
   <result timeType='medium' draft='unconfirmed'>12/09/2000 22:59:59</result>
   <result draft='approved'>2000-09-12 22:59:59</result>
   <result dateType='medium' timeType='none' draft='unconfirmed approved'>12/09/2000</result>
   <result timeType='short'>12/09/2000 22:59</result>
   <result timeType='medium'>12/09/2000 22:59:59</result>
   <result dateType='long' timeType='none' draft='unconfirmed'>12 September 2000</result>
   <result draft='approved'>2000 September 12</result>
   <result timeType='short' draft='unconfirmed'>12 September 2000 22:59</result>
   <result draft='approved'>2000 September 12 22:59</result>
   <result timeType='medium' draft='unconfirmed'>12 September 2000 22:59:59</result>
   <result draft='approved'>2000 September 12 22:59:59</result>
   <result dateType='full' timeType='none' draft='unconfirmed approved'>12 September 2000</result>
   <result timeType='short'>12 September 2000 22:59</result>
   <result timeType='medium'>12 September 2000 22:59:59</result>
   <result input='2001-10-08T23:00:00Z' dateType='none' timeType='short'>23:00</result>
   <result timeType='medium'>23:00:00</result>
   <result dateType='short' timeType='none' draft='unconfirmed'>08/10/2001</result>
   <result draft='approved'>2001-10-08</result>
   <result timeType='short' draft='unconfirmed'>08/10/2001 23:00</result>
   <result draft='approved'>2001-10-08 23:00</result>
   <result timeType='medium' draft='unconfirmed'>08/10/2001 23:00:00</result>
   <result draft='approved'>2001-10-08 23:00:00</result>
   <result dateType='medium' timeType='none' draft='unconfirmed approved'>08/10/2001</result>
   <result timeType='short'>08/10/2001 23:00</result>
   <result timeType='medium'>08/10/2001 23:00:00</result>
   <result dateType='long' timeType='none' draft='unconfirmed'>08 Oktober 2001</result>
   <result draft='approved'>2001 Oktober 8</result>
   <result timeType='short' draft='unconfirmed'>08 Oktober 2001 23:00</result>
   <result draft='approved'>2001 Oktober 8 23:00</result>
   <result timeType='medium' draft='unconfirmed'>08 Oktober 2001 23:00:00</result>
   <result draft='approved'>2001 Oktober 8 23:00:00</result>
   <result dateType='full' timeType='none' draft='unconfirmed approved'>08 Oktober 2001</result>
   <result timeType='short'>08 Oktober 2001 23:00</result>
   <result timeType='medium'>08 Oktober 2001 23:00:00</result>
   <result input='2004-11-04T23:00:01Z' dateType='none' timeType='short'>23:00</result>
   <result timeType='medium'>23:00:01</result>
   <result dateType='short' timeType='none' draft='unconfirmed'>04/11/2004</result>
   <result draft='approved'>2004-11-04</result>
   <result timeType='short' draft='unconfirmed'>04/11/2004 23:00</result>
   <result draft='approved'>2004-11-04 23:00</result>
   <result timeType='medium' draft='unconfirmed'>04/11/2004 23:00:01</result>
   <result draft='approved'>2004-11-04 23:00:01</result>
   <result dateType='medium' timeType='none' draft='unconfirmed approved'>04/11/2004</result>
   <result timeType='short'>04/11/2004 23:00</result>
   <result timeType='medium'>04/11/2004 23:00:01</result>
   <result dateType='long' timeType='none' draft='unconfirmed'>04 November 2004</result>
   <result draft='approved'>2004 November 4</result>
   <result timeType='short' draft='unconfirmed'>04 November 2004 23:00</result>
   <result draft='approved'>2004 November 4 23:00</result>
   <result timeType='medium' draft='unconfirmed'>04 November 2004 23:00:01</result>
   <result draft='approved'>2004 November 4 23:00:01</result>
   <result dateType='full' timeType='none' draft='unconfirmed approved'>04 November 2004</result>
   <result timeType='short'>04 November 2004 23:00</result>
   <result timeType='medium'>04 November 2004 23:00:01</result>
   <result input='2010-12-01T23:59:59Z' dateType='none' timeType='short'>23:59</result>
   <result timeType='medium'>23:59:59</result>
   <result dateType='short' timeType='none' draft='unconfirmed'>01/12/2010</result>
   <result draft='approved'>2010-12-01</result>
   <result timeType='short' draft='unconfirmed'>01/12/2010 23:59</result>
   <result draft='approved'>2010-12-01 23:59</result>
   <result timeType='medium' draft='unconfirmed'>01/12/2010 23:59:59</result>
   <result draft='approved'>2010-12-01 23:59:59</result>
   <result dateType='medium' timeType='none' draft='unconfirmed approved'>01/12/2010</result>
   <result timeType='short'>01/12/2010 23:59</result>
   <result timeType='medium'>01/12/2010 23:59:59</result>
   <result dateType='long' timeType='none' draft='unconfirmed'>01 Disember 2010</result>
   <result draft='approved'>2010 Disember 1</result>
   <result timeType='short' draft='unconfirmed'>01 Disember 2010 23:59</result>
   <result draft='approved'>2010 Disember 1 23:59</result>
   <result timeType='medium' draft='unconfirmed'>01 Disember 2010 23:59:59</result>
   <result draft='approved'>2010 Disember 1 23:59:59</result>
   <result dateType='full' timeType='none' draft='unconfirmed approved'>01 Disember 2010</result>
   <result timeType='short'>01 Disember 2010 23:59</result>
   <result timeType='medium'>01 Disember 2010 23:59:59</result>
  </date>
  <zoneFields 
locales='ms ms_BN ms_MY'>
<!-- Malay [Bahasa Melayu@]; Malay (Brunei) [Bahasa Melayu (Brunei)@]; Malay (Malaysia) [Bahasa Melayu (Malaysia)@] -->
  </zoneFields>
  <collation 
locales='ms ms_BN ms_MY'>
<!-- Malay [Bahasa Melayu@]; Malay (Brunei) [Bahasa Melayu (Brunei)@]; Malay (Malaysia) [Bahasa Melayu (Malaysia)@] -->
   <result draft='unconfirmed approved'>
x 
X 
x x
x.
X.
x.x
x0
X0
x0x
x12
X12
x12x
x2
X2
x2x
xa
xA
Xa
XA
xai
xaI
xAi
xAI
Xai
XaI
XAi
XAI
xaix
xaIx
xAix
xAIx
xau
xaU
xAu
xAU
Xau
XaU
XAu
XAU
xaux
xaUx
xAux
xAUx
xax
xAx
xb
xB
Xb
XB
xbx
xBx
xc
xC
Xc
XC
xcx
xCx
xd
xD
Xd
XD
xdx
xDx
xdz
xdZ
xDz
xDZ
Xdz
XdZ
XDz
XDZ
xdzx
xdZx
xDzx
xDZx
xe
xE
Xe
XE
xex
xEx
xf
xF
Xf
XF
xfx
xFx
xg
xG
Xg
XG
xgx
xGx
xh
xH
Xh
XH
xhx
xHx
xi
xI
Xi
XI
xix
xIx
xj
xJ
Xj
XJ
xjx
xJx
xk
xK
Xk
XK
xkh
xkH
xKh
xKH
Xkh
XkH
XKh
XKH
xkhx
xkHx
xKhx
xKHx
xkx
xKx
xl
xL
Xl
XL
xlx
xLx
xm
xM
Xm
XM
xmx
xMx
xn
xN
Xn
XN
xng
xnG
xNg
xNG
Xng
XnG
XNg
XNG
xngg
xngG
xnGg
xnGG
xNgg
xNgG
xNGg
xNGG
Xngg
XngG
XnGg
XnGG
XNgg
XNgG
XNGg
XNGG
xnggx
xngGx
xnGgx
xnGGx
xNggx
xNgGx
xNGgx
xNGGx
xngx
xnGx
xNgx
xNGx
xnx
xNx
xny
xnY
xNy
xNY
Xny
XnY
XNy
XNY
xnyx
xnYx
xNyx
xNYx
xo
xO
Xo
XO
xox
xOx
xp
xP
Xp
XP
xpx
xPx
xq
xQ
Xq
XQ
xqx
xQx
xr
xR
Xr
XR
xrx
xRx
xs
xS
Xs
XS
xsx
xSx
xsy
xsY
xSy
xSY
Xsy
XsY
XSy
XSY
xsyx
xsYx
xSyx
xSYx
xt
xT
Xt
XT
xts
xtS
xTs
xTS
Xts
XtS
XTs
XTS
xtsx
xtSx
xTsx
xTSx
xtx
xTx
xu
xU
Xu
XU
xua
xuA
xUa
xUA
Xua
XuA
XUa
XUA
xuax
xuAx
xUax
xUAx
xux
xUx
xv
xV
Xv
XV
xvx
xVx
xw
xW
Xw
XW
xwx
xWx
xx
xX
Xx
XX
xxx
xXx
xy
xY
Xy
XY
xyx
xYx
xz
xZ
Xz
XZ
xzx
xZx
</result>
  </collation>
 </cldrTest>
