Skipping inheritance from	[aao]	ar	from	Algerian Saharan Arabic (aao) (aao, Q5672), Maghrebi Arabic (Q119479), Arabic (ar) (ar, Q1395), Semitic [Other] (sem) (sem, Q3404), Afro-Asiatic [Other] (afa) (afa, Q2526), Q2016217 (Q2016217); Algerian Saharan Arabic (aao) (aao, Q5672), Maghrebi Arabic (Q119479), Arabic (ar) (ar, Q1395), Semitic [Other] (sem) (sem, Q3404), Afro-Asiatic [Other] (afa) (afa, Q2526), Q27631 (Q27631)
Skipping inheritance from	[aat]	sq	from	Arvanitika Albanian (aat) (aat, Q2934), Albanian (sq) (sq, Q18093)
Skipping inheritance from	[abh]	ar-143	from	Tajiki Arabic (abh) (abh, Q5683), Arabic (Central Asia) (ar-143) (ar-143, Q5094844), Q142242 (Q142242), Arabic (ar) (ar, Q1395), Semitic [Other] (sem) (sem, Q3404), Afro-Asiatic [Other] (afa) (afa, Q2526), Q2016217 (Q2016217); Tajiki Arabic (abh) (abh, Q5683), Arabic (Central Asia) (ar-143) (ar-143, Q5094844), Q142242 (Q142242), Arabic (ar) (ar, Q1395), Semitic [Other] (sem) (sem, Q3404), Afro-Asiatic [Other] (afa) (afa, Q2526), Q27631 (Q27631)
Skipping inheritance from	[abh]	ar	from	Tajiki Arabic (abh) (abh, Q5683), Arabic (Central Asia) (ar-143) (ar-143, Q5094844), Q142242 (Q142242), Arabic (ar) (ar, Q1395), Semitic [Other] (sem) (sem, Q3404), Afro-Asiatic [Other] (afa) (afa, Q2526), Q2016217 (Q2016217); Tajiki Arabic (abh) (abh, Q5683), Arabic (Central Asia) (ar-143) (ar-143, Q5094844), Q142242 (Q142242), Arabic (ar) (ar, Q1395), Semitic [Other] (sem) (sem, Q3404), Afro-Asiatic [Other] (afa) (afa, Q2526), Q27631 (Q27631)
Skipping inheritance from	[abr]	ak	from	Abron (abr) (abr, Q3483), Central Tano (Q165848), Potou–Tano (Q147500), Nyo (Q200617), Kwa (Q3343), Volta–Congo (Q3722), Atlantic-Congo languages (alv) (alv, Q77112), Niger-Kordofanian [Other] (nic) (nic, Q3383), Q2016217 (Q2016217); Abron (abr) (abr, Q3483), Akan (ak) (ak, Q2802), Central Tano (Q165848), Potou–Tano (Q147500), Nyo (Q200617), Kwa (Q3343), Volta–Congo (Q3722), Atlantic-Congo languages (alv) (alv, Q77112), Niger-Kordofanian [Other] (nic) (nic, Q3383), Q2016217 (Q2016217); Abron (abr) (abr, Q3483), Akan (ak) (ak, Q2802), Kwa (Q3343), Volta–Congo (Q3722), Atlantic-Congo languages (alv) (alv, Q77112), Niger-Kordofanian [Other] (nic) (nic, Q3383), Q2016217 (Q2016217)
Skipping inheritance from	[acf]	cpf-029	from	Saint Lucian Creole French (acf) (acf, Q300628), Antillean Creole (Q3502), Creoles and pidgins, French-based [Other] (Caribbean) (cpf-029) (cpf-029, Q12316185), Creoles and pidgins, French-based [Other] (cpf) (cpf, Q3326), Creoles and pidgins [Other] (crp) (crp, Q1968216)
Skipping inheritance from	[acn]	acn	from	Achang (acn) (acn, Q1088427), Achang (acn) (acn, Q5658), Burmish (Q86571), Lolo-Burmese (Q163571), Burmo-Qiangic (Q1605627), Sino-Tibetan [Other] (sit) (sit, Q4596), Dené–Caucasian (Q50796), Q1737690 (Q1737690); Achang (acn) (acn, Q1088427), Achang (acn) (acn, Q5658), Burmish (Q86571), Lolo-Burmese (Q163571), Burmo-Qiangic (Q1605627), Sino-Tibetan [Other] (sit) (sit, Q4596), Sino-Austronesian (Q752474), Q2016217 (Q2016217); Achang (acn) (acn, Q1088427), Achang (acn) (acn, Q5658), Burmish (Q86571), Lolo-Burmese (Q163571), Burmo-Qiangic (Q1605627), Sino-Tibetan [Other] (sit) (sit, Q4596), Sino-Tibetan-Indo-European (Q9769070), Q2016217 (Q2016217); Achang (acn) (acn, Q1088427), Achang (acn) (acn, Q5658), Burmish (Q86571), Lolo-Burmese (Q163571), Burmo-Qiangic (Q1605627), Sino-Tibetan [Other] (sit) (sit, Q4596), Q9879175 (Q9879175)
Skipping inheritance from	[acq]	ar	from	Ta'izzi-Adeni Arabic (acq) (acq, Q5657), Yemeni Arabic (Q168676), Q1504357 (Q1504357), Arabic (ar) (ar, Q1395), Semitic [Other] (sem) (sem, Q3404), Afro-Asiatic [Other] (afa) (afa, Q2526), Q2016217 (Q2016217); Ta'izzi-Adeni Arabic (acq) (acq, Q5657), Yemeni Arabic (Q168676), Q1504357 (Q1504357), Arabic (ar) (ar, Q1395), Semitic [Other] (sem) (sem, Q3404), Afro-Asiatic [Other] (afa) (afa, Q2526), Q27631 (Q27631)
Skipping inheritance from	[act]	nds-NL	from	Achterhoeks (act) (act, Q15362), Low Saxon (nds-NL) (nds-NL, Q51613), West Low German (Q16844), Low German (nds) (nds, Q2543), North Sea Germanic (Q3013), West Germanic languages (gmw) (gmw, Q2672), Germanic [Other] (gem) (gem, Q2120), Indo-European [Other] (ine) (ine, Q1986), Q2016217 (Q2016217); Achterhoeks (act) (act, Q15362), Low Saxon (nds-NL) (nds-NL, Q51613), West Low German (Q16844), Low German (nds) (nds, Q2543), North Sea Germanic (Q3013), West Germanic languages (gmw) (gmw, Q2672), Germanic [Other] (gem) (gem, Q2120), Indo-European [Other] (ine) (ine, Q1986), Q27631 (Q27631); Achterhoeks (act) (act, Q15362), Low Saxon (nds-NL) (nds-NL, Q51613), West Low German (Q16844), Low German (nds) (nds, Q2543), North Sea Germanic (Q3013), West Germanic languages (gmw) (gmw, Q2672), Germanic [Other] (gem) (gem, Q2120), Indo-European [Other] (ine) (ine, Q1986), Q77186 (Q77186)
Skipping inheritance from	[act]	nds	from	Achterhoeks (act) (act, Q15362), Low Saxon (nds-NL) (nds-NL, Q51613), West Low German (Q16844), Low German (nds) (nds, Q2543), North Sea Germanic (Q3013), West Germanic languages (gmw) (gmw, Q2672), Germanic [Other] (gem) (gem, Q2120), Indo-European [Other] (ine) (ine, Q1986), Q2016217 (Q2016217); Achterhoeks (act) (act, Q15362), Low Saxon (nds-NL) (nds-NL, Q51613), West Low German (Q16844), Low German (nds) (nds, Q2543), North Sea Germanic (Q3013), West Germanic languages (gmw) (gmw, Q2672), Germanic [Other] (gem) (gem, Q2120), Indo-European [Other] (ine) (ine, Q1986), Q27631 (Q27631); Achterhoeks (act) (act, Q15362), Low Saxon (nds-NL) (nds-NL, Q51613), West Low German (Q16844), Low German (nds) (nds, Q2543), North Sea Germanic (Q3013), West Germanic languages (gmw) (gmw, Q2672), Germanic [Other] (gem) (gem, Q2120), Indo-European [Other] (ine) (ine, Q1986), Q77186 (Q77186)
Skipping inheritance from	[acw]	ar	from	Hijazi Arabic (acw) (acw, Q5660), Q1504357 (Q1504357), Arabic (ar) (ar, Q1395), Semitic [Other] (sem) (sem, Q3404), Afro-Asiatic [Other] (afa) (afa, Q2526), Q2016217 (Q2016217); Hijazi Arabic (acw) (acw, Q5660), Q1504357 (Q1504357), Arabic (ar) (ar, Q1395), Semitic [Other] (sem) (sem, Q3404), Afro-Asiatic [Other] (afa) (afa, Q2526), Q27631 (Q27631)
Skipping inheritance from	[acy]	ar	from	Cypriot Arabic (acy) (acy, Q5641), Arabic (ar) (ar, Q1395), Semitic [Other] (sem) (sem, Q3404), Afro-Asiatic [Other] (afa) (afa, Q2526), Q2016217 (Q2016217); Cypriot Arabic (acy) (acy, Q5641), Arabic (ar) (ar, Q1395), Semitic [Other] (sem) (sem, Q3404), Afro-Asiatic [Other] (afa) (afa, Q2526), Q27631 (Q27631)
Skipping inheritance from	[adf]	ar	from	Dhofari Arabic (adf) (adf, Q5656), Q1504357 (Q1504357), Arabic (ar) (ar, Q1395), Semitic [Other] (sem) (sem, Q3404), Afro-Asiatic [Other] (afa) (afa, Q2526), Q2016217 (Q2016217); Dhofari Arabic (adf) (adf, Q5656), Q1504357 (Q1504357), Arabic (ar) (ar, Q1395), Semitic [Other] (sem) (sem, Q3404), Afro-Asiatic [Other] (afa) (afa, Q2526), Q27631 (Q27631)
Skipping inheritance from	[aeb]	ar	from	Tunisian Arabic (aeb) (aeb, Q5624), Maghrebi Arabic (Q119479), Arabic (ar) (ar, Q1395), Semitic [Other] (sem) (sem, Q3404), Afro-Asiatic [Other] (afa) (afa, Q2526), Q2016217 (Q2016217); Tunisian Arabic (aeb) (aeb, Q5624), Maghrebi Arabic (Q119479), Arabic (ar) (ar, Q1395), Semitic [Other] (sem) (sem, Q3404), Afro-Asiatic [Other] (afa) (afa, Q2526), Q27631 (Q27631)
Skipping inheritance from	[aeb]	jrb	from	Tunisian Arabic (aeb) (aeb, Q5659), Judeo-Arabic (jrb) (jrb, Q3773), Q61594 (Q61594); Tunisian Arabic (aeb) (aeb, Q5659), Judeo-Arabic (jrb) (jrb, Q3773), Arabic (ar) (ar, Q1395), Semitic [Other] (sem) (sem, Q3404), Afro-Asiatic [Other] (afa) (afa, Q2526), Q2016217 (Q2016217); Tunisian Arabic (aeb) (aeb, Q5659), Judeo-Arabic (jrb) (jrb, Q3773), Arabic (ar) (ar, Q1395), Semitic [Other] (sem) (sem, Q3404), Afro-Asiatic [Other] (afa) (afa, Q2526), Q27631 (Q27631)
Skipping inheritance from	[aeb]	ar	from	Tunisian Arabic (aeb) (aeb, Q5659), Judeo-Arabic (jrb) (jrb, Q3773), Q61594 (Q61594); Tunisian Arabic (aeb) (aeb, Q5659), Judeo-Arabic (jrb) (jrb, Q3773), Arabic (ar) (ar, Q1395), Semitic [Other] (sem) (sem, Q3404), Afro-Asiatic [Other] (afa) (afa, Q2526), Q2016217 (Q2016217); Tunisian Arabic (aeb) (aeb, Q5659), Judeo-Arabic (jrb) (jrb, Q3773), Arabic (ar) (ar, Q1395), Semitic [Other] (sem) (sem, Q3404), Afro-Asiatic [Other] (afa) (afa, Q2526), Q27631 (Q27631)
Skipping inheritance from	[aec]	ar	from	Saidi Arabic (aec) (aec, Q5659), Arabic (ar) (ar, Q1395), Semitic [Other] (sem) (sem, Q3404), Afro-Asiatic [Other] (afa) (afa, Q2526), Q2016217 (Q2016217); Saidi Arabic (aec) (aec, Q5659), Arabic (ar) (ar, Q1395), Semitic [Other] (sem) (sem, Q3404), Afro-Asiatic [Other] (afa) (afa, Q2526), Q27631 (Q27631)
Skipping inheritance from	[aez]	okv	from	Aeka (aez) (aez, Q1611052), Orokaiva (okv) (okv, Q710375), Binanderean (Q321737), Trans-New Guinea languages (ngf) (ngf, Q3401), Papuan [Other] (paa) (paa, Q23642)
Skipping inheritance from	[afb]	ar	from	Gulf Arabic (afb) (afb, Q5638), Q1504357 (Q1504357), Arabic (ar) (ar, Q1395), Semitic [Other] (sem) (sem, Q3404), Afro-Asiatic [Other] (afa) (afa, Q2526), Q2016217 (Q2016217); Gulf Arabic (afb) (afb, Q5638), Q1504357 (Q1504357), Arabic (ar) (ar, Q1395), Semitic [Other] (sem) (sem, Q3404), Afro-Asiatic [Other] (afa) (afa, Q2526), Q27631 (Q27631)
Skipping inheritance from	[afs]	gul	from	Afro-Seminole Creole (afs) (afs, Q2786), Sea Island Creole English (gul) (gul, Q3339), Creoles and pidgins, English based [Other] (cpe) (cpe, Q3198)
Skipping inheritance from	[agk]	bik	from	Isarog Agta (agk) (agk, Q607898), Bikol (bik) (bik, Q3545), Central Philippine (Q311965), Greater Central Philippine (Q383299), Philippine [Other] (phi) (phi, Q94785), Malayo-Polynesian languages (poz) (poz, Q14315), Austronesian [Other] (map) (map, Q4922), Sino-Austronesian (Q752474), Q2016217 (Q2016217); Isarog Agta (agk) (agk, Q607898), Bikol (bik) (bik, Q3545), Central Philippine (Q311965), Greater Central Philippine (Q383299), Philippine [Other] (phi) (phi, Q94785), Malayo-Polynesian languages (poz) (poz, Q14315), Austronesian [Other] (map) (map, Q4922), Austric (Q78378), Q2016217 (Q2016217); Isarog Agta (agk) (agk, Q607898), Bikol (bik) (bik, Q3545), Central Philippine (Q311965), Greater Central Philippine (Q383299), Philippine [Other] (phi) (phi, Q94785), Malayo-Polynesian languages (poz) (poz, Q14315), Austronesian [Other] (map) (map, Q4922), Austro-Tai (Q78381), Q2016217 (Q2016217)
Skipping inheritance from	[ahr]	khn	from	Ahirani (ahr) (ahr, Q1554989), Khandesi (khn) (khn, Q3372), Central Indo-Aryan (Q1097918), Indic [Other] (inc) (inc, Q3357), Q1560938 (Q1560938); Ahirani (ahr) (ahr, Q1554989), Khandesi (khn) (khn, Q3372), Central Indo-Aryan (Q1097918), Indic [Other] (inc) (inc, Q3357), Indo-Iranian languages (iir) (iir, Q3351), Q9879175 (Q9879175); Ahirani (ahr) (ahr, Q1554989), Khandesi (khn) (khn, Q3372), Central Indo-Aryan (Q1097918), Indic [Other] (inc) (inc, Q3357), Indo-Iranian languages (iir) (iir, Q3351), Indo-European [Other] (ine) (ine, Q1986), Q2016217 (Q2016217); Ahirani (ahr) (ahr, Q1554989), Khandesi (khn) (khn, Q3372), Central Indo-Aryan (Q1097918), Indic [Other] (inc) (inc, Q3357), Indo-Iranian languages (iir) (iir, Q3351), Indo-European [Other] (ine) (ine, Q1986), Q27631 (Q27631); Ahirani (ahr) (ahr, Q1554989), Khandesi (khn) (khn, Q3372), Central Indo-Aryan (Q1097918), Indic [Other] (inc) (inc, Q3357), Indo-Iranian languages (iir) (iir, Q3351), Indo-European [Other] (ine) (ine, Q1986), Q77186 (Q77186)
Skipping inheritance from	[aiy]	gba	from	Ali (aiy) (aiy, Q3481), Gbaya (gba) (gba, Q309998), Gbaya-Manza-Ngbaka (Q2549451), Volta–Congo (Q3722), Atlantic-Congo languages (alv) (alv, Q77112), Niger-Kordofanian [Other] (nic) (nic, Q3383), Q2016217 (Q2016217); Ali (aiy) (aiy, Q3481), Gbaya (gba) (gba, Q309998), Ubangian (Q3393), Adamawa–Ubangi (Q35153), Volta–Congo (Q3722), Atlantic-Congo languages (alv) (alv, Q77112), Niger-Kordofanian [Other] (nic) (nic, Q3383), Q2016217 (Q2016217)
Skipping inheritance from	[ak]	ak	from	Akan (ak) (ak, Q3557), Central Tano (Q165848), Potou–Tano (Q147500), Nyo (Q200617), Kwa (Q3343), Volta–Congo (Q3722), Atlantic-Congo languages (alv) (alv, Q77112), Niger-Kordofanian [Other] (nic) (nic, Q3383), Q2016217 (Q2016217); Akan (ak) (ak, Q3557), Akan (ak) (ak, Q2802), Central Tano (Q165848), Potou–Tano (Q147500), Nyo (Q200617), Kwa (Q3343), Volta–Congo (Q3722), Atlantic-Congo languages (alv) (alv, Q77112), Niger-Kordofanian [Other] (nic) (nic, Q3383), Q2016217 (Q2016217); Akan (ak) (ak, Q3557), Akan (ak) (ak, Q2802), Kwa (Q3343), Volta–Congo (Q3722), Atlantic-Congo languages (alv) (alv, Q77112), Niger-Kordofanian [Other] (nic) (nic, Q3383), Q2016217 (Q2016217)
Skipping inheritance from	[ak]	ak	from	Akan (ak) (ak, Q3685), Central Tano (Q165848), Potou–Tano (Q147500), Nyo (Q200617), Kwa (Q3343), Volta–Congo (Q3722), Atlantic-Congo languages (alv) (alv, Q77112), Niger-Kordofanian [Other] (nic) (nic, Q3383), Q2016217 (Q2016217); Akan (ak) (ak, Q3685), Akan (ak) (ak, Q2802), Central Tano (Q165848), Potou–Tano (Q147500), Nyo (Q200617), Kwa (Q3343), Volta–Congo (Q3722), Atlantic-Congo languages (alv) (alv, Q77112), Niger-Kordofanian [Other] (nic) (nic, Q3383), Q2016217 (Q2016217); Akan (ak) (ak, Q3685), Akan (ak) (ak, Q2802), Kwa (Q3343), Volta–Congo (Q3722), Atlantic-Congo languages (alv) (alv, Q77112), Niger-Kordofanian [Other] (nic) (nic, Q3383), Q2016217 (Q2016217)
Skipping inheritance from	[aln]	sq	from	Gheg Albanian (aln) (aln, Q18103), Albanian (sq) (sq, Q874), Indo-European [Other] (ine) (ine, Q1986), Q2016217 (Q2016217); Gheg Albanian (aln) (aln, Q18103), Albanian (sq) (sq, Q874), Indo-European [Other] (ine) (ine, Q1986), Q27631 (Q27631); Gheg Albanian (aln) (aln, Q18103), Albanian (sq) (sq, Q874), Indo-European [Other] (ine) (ine, Q1986), Q77186 (Q77186)
Skipping inheritance from	[alq]	oj	from	Algonquin (alq) (alq, Q2809), Ojibwa (oj) (oj, Q3387), Central Algonquian (Q215399), Algonquian languages (alg) (alg, Q3339), Algic languages (aql) (aql, Q72161), Q5173 (Q5173)
Skipping inheritance from	[ami]	ami	from	Amis (ami) (ami, Q4250814), Amis (ami) (ami, Q3513), East Formosan (Q71667), Paiwanic (Q1107804), Formosan languages (fox) (fox, Q71527), Austronesian [Other] (map) (map, Q4922), Sino-Austronesian (Q752474), Q2016217 (Q2016217); Amis (ami) (ami, Q4250814), Amis (ami) (ami, Q3513), East Formosan (Q71667), Paiwanic (Q1107804), Formosan languages (fox) (fox, Q71527), Austronesian [Other] (map) (map, Q4922), Austric (Q78378), Q2016217 (Q2016217); Amis (ami) (ami, Q4250814), Amis (ami) (ami, Q3513), East Formosan (Q71667), Paiwanic (Q1107804), Formosan languages (fox) (fox, Q71527), Austronesian [Other] (map) (map, Q4922), Austro-Tai (Q78381), Q2016217 (Q2016217); Amis (ami) (ami, Q4250814), Amis (ami) (ami, Q3513), East Formosan (Q71667), Formosan languages (fox) (fox, Q71527), Austronesian [Other] (map) (map, Q4922), Sino-Austronesian (Q752474), Q2016217 (Q2016217); Amis (ami) (ami, Q4250814), Amis (ami) (ami, Q3513), East Formosan (Q71667), Formosan languages (fox) (fox, Q71527), Austronesian [Other] (map) (map, Q4922), Austric (Q78378), Q2016217 (Q2016217); Amis (ami) (ami, Q4250814), Amis (ami) (ami, Q3513), East Formosan (Q71667), Formosan languages (fox) (fox, Q71527), Austronesian [Other] (map) (map, Q4922), Austro-Tai (Q78381), Q2016217 (Q2016217)
Skipping inheritance from	[amz]	urf	from	Atampaya (amz) (amz, Q344665), Uradhi (urf) (urf, Q391568), North Cape York Paman (Q705436), Paman (Q264065), Pama–Nyungan (Q3394), Australian languages (aus) (aus, Q20514), Q2016217 (Q2016217)
Skipping inheritance from	[anp]	hi	from	Angika (anp) (anp, Q2837), Hindi (hi) (hi, Q156)
Skipping inheritance from	[apc]	ar	from	Levantine Arabic (apc) (apc, Q2280948), Levantine Arabic (Q5659), Arabic (ar) (ar, Q1395), Semitic [Other] (sem) (sem, Q3404), Afro-Asiatic [Other] (afa) (afa, Q2526), Q2016217 (Q2016217); Levantine Arabic (apc) (apc, Q2280948), Levantine Arabic (Q5659), Arabic (ar) (ar, Q1395), Semitic [Other] (sem) (sem, Q3404), Afro-Asiatic [Other] (afa) (afa, Q2526), Q27631 (Q27631)
Skipping inheritance from	[apc]	ar	from	Levantine Arabic (apc) (apc, Q5563358), Levantine Arabic (Q5659), Arabic (ar) (ar, Q1395), Semitic [Other] (sem) (sem, Q3404), Afro-Asiatic [Other] (afa) (afa, Q2526), Q2016217 (Q2016217); Levantine Arabic (apc) (apc, Q5563358), Levantine Arabic (Q5659), Arabic (ar) (ar, Q1395), Semitic [Other] (sem) (sem, Q3404), Afro-Asiatic [Other] (afa) (afa, Q2526), Q27631 (Q27631)
Skipping inheritance from	[apd]	ar	from	Sudanese Arabic (apd) (apd, Q5657), Arabic (ar) (ar, Q1395), Semitic [Other] (sem) (sem, Q3404), Afro-Asiatic [Other] (afa) (afa, Q2526), Q2016217 (Q2016217); Sudanese Arabic (apd) (apd, Q5657), Arabic (ar) (ar, Q1395), Semitic [Other] (sem) (sem, Q3404), Afro-Asiatic [Other] (afa) (afa, Q2526), Q27631 (Q27631)
Skipping inheritance from	[apx]	ilu	from	Aputai (apx) (apx, Q1247334), Ili'uun (ilu) (ilu, Q1263288), Wetarese (Q3687), Timoric (Q780698), Central Malayo-Polynesian languages (plf) (plf, Q252667), Central-Eastern Malayo-Polynesian (Q226988), Nuclear Malayo-Polynesian (Q119060), Malayo-Polynesian languages (poz) (poz, Q14315), Austronesian [Other] (map) (map, Q4922), Sino-Austronesian (Q752474), Q2016217 (Q2016217); Aputai (apx) (apx, Q1247334), Ili'uun (ilu) (ilu, Q1263288), Wetarese (Q3687), Timoric (Q780698), Central Malayo-Polynesian languages (plf) (plf, Q252667), Central-Eastern Malayo-Polynesian (Q226988), Nuclear Malayo-Polynesian (Q119060), Malayo-Polynesian languages (poz) (poz, Q14315), Austronesian [Other] (map) (map, Q4922), Austric (Q78378), Q2016217 (Q2016217); Aputai (apx) (apx, Q1247334), Ili'uun (ilu) (ilu, Q1263288), Wetarese (Q3687), Timoric (Q780698), Central Malayo-Polynesian languages (plf) (plf, Q252667), Central-Eastern Malayo-Polynesian (Q226988), Nuclear Malayo-Polynesian (Q119060), Malayo-Polynesian languages (poz) (poz, Q14315), Austronesian [Other] (map) (map, Q4922), Austro-Tai (Q78381), Q2016217 (Q2016217); Aputai (apx) (apx, Q1247334), Wetarese (Q3687), Timoric (Q780698), Central Malayo-Polynesian languages (plf) (plf, Q252667), Central-Eastern Malayo-Polynesian (Q226988), Nuclear Malayo-Polynesian (Q119060), Malayo-Polynesian languages (poz) (poz, Q14315), Austronesian [Other] (map) (map, Q4922), Sino-Austronesian (Q752474), Q2016217 (Q2016217); Aputai (apx) (apx, Q1247334), Wetarese (Q3687), Timoric (Q780698), Central Malayo-Polynesian languages (plf) (plf, Q252667), Central-Eastern Malayo-Polynesian (Q226988), Nuclear Malayo-Polynesian (Q119060), Malayo-Polynesian languages (poz) (poz, Q14315), Austronesian [Other] (map) (map, Q4922), Austric (Q78378), Q2016217 (Q2016217); Aputai (apx) (apx, Q1247334), Wetarese (Q3687), Timoric (Q780698), Central Malayo-Polynesian languages (plf) (plf, Q252667), Central-Eastern Malayo-Polynesian (Q226988), Nuclear Malayo-Polynesian (Q119060), Malayo-Polynesian languages (poz) (poz, Q14315), Austronesian [Other] (map) (map, Q4922), Austro-Tai (Q78381), Q2016217 (Q2016217)
Skipping inheritance from	[ar]	ar	from	Arabic (ar) (ar, Q12260298), Arabic (ar) (ar, Q1395), Semitic [Other] (sem) (sem, Q3404), Afro-Asiatic [Other] (afa) (afa, Q2526), Q2016217 (Q2016217); Arabic (ar) (ar, Q12260298), Arabic (ar) (ar, Q1395), Semitic [Other] (sem) (sem, Q3404), Afro-Asiatic [Other] (afa) (afa, Q2526), Q27631 (Q27631)
Skipping inheritance from	[ari]	cad	from	Arikara (ari) (ari, Q5653), Caddo (cad) (cad, Q5675), Caddoan languages (cdd) (cdd, Q102509), Q5173 (Q5173)
Skipping inheritance from	[arq]	ar	from	Algerian Arabic (arq) (arq, Q5649), Maghrebi Arabic (Q119479), Arabic (ar) (ar, Q1395), Semitic [Other] (sem) (sem, Q3404), Afro-Asiatic [Other] (afa) (afa, Q2526), Q2016217 (Q2016217); Algerian Arabic (arq) (arq, Q5649), Maghrebi Arabic (Q119479), Arabic (ar) (ar, Q1395), Semitic [Other] (sem) (sem, Q3404), Afro-Asiatic [Other] (afa) (afa, Q2526), Q27631 (Q27631)
Skipping inheritance from	[ars]	ar	from	Najdi Arabic (ars) (ars, Q5657), Q1504357 (Q1504357), Arabic (ar) (ar, Q1395), Semitic [Other] (sem) (sem, Q3404), Afro-Asiatic [Other] (afa) (afa, Q2526), Q2016217 (Q2016217); Najdi Arabic (ars) (ars, Q5657), Q1504357 (Q1504357), Arabic (ar) (ar, Q1395), Semitic [Other] (sem) (sem, Q3404), Afro-Asiatic [Other] (afa) (afa, Q2526), Q27631 (Q27631)
Skipping inheritance from	[ary]	ar	from	Moroccan Arabic (ary) (ary, Q5642), Maghrebi Arabic (Q119479), Arabic (ar) (ar, Q1395), Semitic [Other] (sem) (sem, Q3404), Afro-Asiatic [Other] (afa) (afa, Q2526), Q2016217 (Q2016217); Moroccan Arabic (ary) (ary, Q5642), Maghrebi Arabic (Q119479), Arabic (ar) (ar, Q1395), Semitic [Other] (sem) (sem, Q3404), Afro-Asiatic [Other] (afa) (afa, Q2526), Q27631 (Q27631)
Skipping inheritance from	[atl]	bik	from	Mt. Iraya Agta (atl) (atl, Q692143), Bikol (bik) (bik, Q3545), Central Philippine (Q311965), Greater Central Philippine (Q383299), Philippine [Other] (phi) (phi, Q94785), Malayo-Polynesian languages (poz) (poz, Q14315), Austronesian [Other] (map) (map, Q4922), Sino-Austronesian (Q752474), Q2016217 (Q2016217); Mt. Iraya Agta (atl) (atl, Q692143), Bikol (bik) (bik, Q3545), Central Philippine (Q311965), Greater Central Philippine (Q383299), Philippine [Other] (phi) (phi, Q94785), Malayo-Polynesian languages (poz) (poz, Q14315), Austronesian [Other] (map) (map, Q4922), Austric (Q78378), Q2016217 (Q2016217); Mt. Iraya Agta (atl) (atl, Q692143), Bikol (bik) (bik, Q3545), Central Philippine (Q311965), Greater Central Philippine (Q383299), Philippine [Other] (phi) (phi, Q94785), Malayo-Polynesian languages (poz) (poz, Q14315), Austronesian [Other] (map) (map, Q4922), Austro-Tai (Q78381), Q2016217 (Q2016217)
Skipping inheritance from	[auz]	ar-143	from	Uzbeki Arabic (auz) (auz, Q339950), Arabic (Central Asia) (ar-143) (ar-143, Q5094844), Q142242 (Q142242), Arabic (ar) (ar, Q1395), Semitic [Other] (sem) (sem, Q3404), Afro-Asiatic [Other] (afa) (afa, Q2526), Q2016217 (Q2016217); Uzbeki Arabic (auz) (auz, Q339950), Arabic (Central Asia) (ar-143) (ar-143, Q5094844), Q142242 (Q142242), Arabic (ar) (ar, Q1395), Semitic [Other] (sem) (sem, Q3404), Afro-Asiatic [Other] (afa) (afa, Q2526), Q27631 (Q27631)
Skipping inheritance from	[auz]	ar	from	Uzbeki Arabic (auz) (auz, Q339950), Arabic (Central Asia) (ar-143) (ar-143, Q5094844), Q142242 (Q142242), Arabic (ar) (ar, Q1395), Semitic [Other] (sem) (sem, Q3404), Afro-Asiatic [Other] (afa) (afa, Q2526), Q2016217 (Q2016217); Uzbeki Arabic (auz) (auz, Q339950), Arabic (Central Asia) (ar-143) (ar-143, Q5094844), Q142242 (Q142242), Arabic (ar) (ar, Q1395), Semitic [Other] (sem) (sem, Q3404), Afro-Asiatic [Other] (afa) (afa, Q2526), Q27631 (Q27631)
Skipping inheritance from	[avl]	ar	from	Eastern Egyptian Bedawi Arabic (avl) (avl, Q5671), Arabic (ar) (ar, Q1395), Semitic [Other] (sem) (sem, Q3404), Afro-Asiatic [Other] (afa) (afa, Q2526), Q2016217 (Q2016217); Eastern Egyptian Bedawi Arabic (avl) (avl, Q5671), Arabic (ar) (ar, Q1395), Semitic [Other] (sem) (sem, Q3404), Afro-Asiatic [Other] (afa) (afa, Q2526), Q27631 (Q27631)
Skipping inheritance from	[awu]	ahh	from	Central Awyu (awu) (awu, Q1262880), Awyu (Q1262742), Awyu-Ok (Q2549444), Central and South New Guinea (Q321750), Trans-New Guinea languages (ngf) (ngf, Q3401), Papuan [Other] (paa) (paa, Q23642); Central Awyu (awu) (awu, Q1262880), Aghu (ahh) (ahh, Q343664), Awyu (Q1262742), Awyu-Ok (Q2549444), Central and South New Guinea (Q321750), Trans-New Guinea languages (ngf) (ngf, Q3401), Papuan [Other] (paa) (paa, Q23642)
Skipping inheritance from	[axe]	adg	from	Ayerrerenge (axe) (axe, Q1611273), Andegerebinha (adg) (adg, Q350812), Q176794 (Q176794), Arandic (Q478407), Pama–Nyungan (Q3394), Australian languages (aus) (aus, Q20514), Q2016217 (Q2016217); Ayerrerenge (axe) (axe, Q1611273), Andegerebinha (adg) (adg, Q350812), Arandic (Q478407), Pama–Nyungan (Q3394), Australian languages (aus) (aus, Q20514), Q2016217 (Q2016217)
Skipping inheritance from	[axm]	hy	from	Middle Armenian (axm) (axm, Q443849), Armenian (hy) (hy, Q878), Indo-European [Other] (ine) (ine, Q1986), Q2016217 (Q2016217); Middle Armenian (axm) (axm, Q443849), Armenian (hy) (hy, Q878), Indo-European [Other] (ine) (ine, Q1986), Q27631 (Q27631); Middle Armenian (axm) (axm, Q443849), Armenian (hy) (hy, Q878), Indo-European [Other] (ine) (ine, Q1986), Q77186 (Q77186)
Skipping inheritance from	[ayc]	ay	from	Southern Aymara (ayc) (ayc, Q350803), Aymara (ay) (ay, Q462), Aymaran (Q3301), Q5173 (Q5173)
Skipping inheritance from	[ayh]	ar	from	Hadrami Arabic (ayh) (ayh, Q351036), Q1504357 (Q1504357), Arabic (ar) (ar, Q1395), Semitic [Other] (sem) (sem, Q3404), Afro-Asiatic [Other] (afa) (afa, Q2526), Q2016217 (Q2016217); Hadrami Arabic (ayh) (ayh, Q351036), Q1504357 (Q1504357), Arabic (ar) (ar, Q1395), Semitic [Other] (sem) (sem, Q3404), Afro-Asiatic [Other] (afa) (afa, Q2526), Q27631 (Q27631)
Skipping inheritance from	[ayl]	ar	from	Libyan Arabic (ayl) (ayl, Q5650), Maghrebi Arabic (Q119479), Arabic (ar) (ar, Q1395), Semitic [Other] (sem) (sem, Q3404), Afro-Asiatic [Other] (afa) (afa, Q2526), Q2016217 (Q2016217); Libyan Arabic (ayl) (ayl, Q5650), Maghrebi Arabic (Q119479), Arabic (ar) (ar, Q1395), Semitic [Other] (sem) (sem, Q3404), Afro-Asiatic [Other] (afa) (afa, Q2526), Q27631 (Q27631)
Skipping inheritance from	[ayn]	ar	from	Sanaani Arabic (ayn) (ayn, Q5657), Yemeni Arabic (Q168676), Q1504357 (Q1504357), Arabic (ar) (ar, Q1395), Semitic [Other] (sem) (sem, Q3404), Afro-Asiatic [Other] (afa) (afa, Q2526), Q2016217 (Q2016217); Sanaani Arabic (ayn) (ayn, Q5657), Yemeni Arabic (Q168676), Q1504357 (Q1504357), Arabic (ar) (ar, Q1395), Semitic [Other] (sem) (sem, Q3404), Afro-Asiatic [Other] (afa) (afa, Q2526), Q27631 (Q27631)
