Skipping inheritance from	[mqj]	sda	from	Mamasa (mqj) (mqj, Q674545), Toraja-Sa'dan (sda) (sda, Q3667), South Sulawesi (Q277819), Malayo-Polynesian languages (poz) (poz, Q14315), Austronesian [Other] (map) (map, Q4922), Sino-Austronesian (Q752474), Q2016217 (Q2016217); Mamasa (mqj) (mqj, Q674545), Toraja-Sa'dan (sda) (sda, Q3667), South Sulawesi (Q277819), Malayo-Polynesian languages (poz) (poz, Q14315), Austronesian [Other] (map) (map, Q4922), Austric (Q78378), Q2016217 (Q2016217); Mamasa (mqj) (mqj, Q674545), Toraja-Sa'dan (sda) (sda, Q3667), South Sulawesi (Q277819), Malayo-Polynesian languages (poz) (poz, Q14315), Austronesian [Other] (map) (map, Q4922), Austro-Tai (Q78381), Q2016217 (Q2016217)
Skipping inheritance from	[mrj]	chm	from	Western Mari (mrj) (mrj, Q177603), Mari (chm) (chm, Q97368), Finno-Volgaic (Q16123), Finno-Permic (Q16124), Finno-Ugrian [Other] (fiu) (fiu, Q7989), Uralic languages (urj) (urj, Q3411), Q2016217 (Q2016217); Western Mari (mrj) (mrj, Q177603), Mari (chm) (chm, Q97368), Finno-Volgaic (Q16123), Finno-Permic (Q16124), Finno-Ugrian [Other] (fiu) (fiu, Q7989), Uralic languages (urj) (urj, Q3411), Ural–Altaic (Q72865), Q20657 (Q20657); Western Mari (mrj) (mrj, Q177603), Mari (chm) (chm, Q97368), Finno-Volgaic (Q16123), Finno-Permic (Q16124), Finno-Ugrian [Other] (fiu) (fiu, Q7989), Uralic languages (urj) (urj, Q3411), Q77186 (Q77186)
Skipping inheritance from	[msb]	bik	from	Masbatenyo (msb) (msb, Q3394), Bisakol (Q321737), Bisayan (Q158445), Central Philippine (Q311965), Greater Central Philippine (Q383299), Philippine [Other] (phi) (phi, Q94785), Malayo-Polynesian languages (poz) (poz, Q14315), Austronesian [Other] (map) (map, Q4922), Sino-Austronesian (Q752474), Q2016217 (Q2016217); Masbatenyo (msb) (msb, Q3394), Bisakol (Q321737), Bisayan (Q158445), Central Philippine (Q311965), Greater Central Philippine (Q383299), Philippine [Other] (phi) (phi, Q94785), Malayo-Polynesian languages (poz) (poz, Q14315), Austronesian [Other] (map) (map, Q4922), Austric (Q78378), Q2016217 (Q2016217); Masbatenyo (msb) (msb, Q3394), Bisakol (Q321737), Bisayan (Q158445), Central Philippine (Q311965), Greater Central Philippine (Q383299), Philippine [Other] (phi) (phi, Q94785), Malayo-Polynesian languages (poz) (poz, Q14315), Austronesian [Other] (map) (map, Q4922), Austro-Tai (Q78381), Q2016217 (Q2016217); Masbatenyo (msb) (msb, Q3394), Bisakol (Q321737), Bikol (bik) (bik, Q3545), Central Philippine (Q311965), Greater Central Philippine (Q383299), Philippine [Other] (phi) (phi, Q94785), Malayo-Polynesian languages (poz) (poz, Q14315), Austronesian [Other] (map) (map, Q4922), Sino-Austronesian (Q752474), Q2016217 (Q2016217); Masbatenyo (msb) (msb, Q3394), Bisakol (Q321737), Bikol (bik) (bik, Q3545), Central Philippine (Q311965), Greater Central Philippine (Q383299), Philippine [Other] (phi) (phi, Q94785), Malayo-Polynesian languages (poz) (poz, Q14315), Austronesian [Other] (map) (map, Q4922), Austric (Q78378), Q2016217 (Q2016217); Masbatenyo (msb) (msb, Q3394), Bisakol (Q321737), Bikol (bik) (bik, Q3545), Central Philippine (Q311965), Greater Central Philippine (Q383299), Philippine [Other] (phi) (phi, Q94785), Malayo-Polynesian languages (poz) (poz, Q14315), Austronesian [Other] (map) (map, Q4922), Austro-Tai (Q78381), Q2016217 (Q2016217)
Skipping inheritance from	[msc]	man	from	Sankaran Maninka (msc) (msc, Q1115581), Mandingo (man) (man, Q3577), Mande languages (dmn) (dmn, Q3368), Niger-Kordofanian [Other] (nic) (nic, Q3383), Q2016217 (Q2016217)
Skipping inheritance from	[msh]	mg	from	Masikoro Malagasy (msh) (msh, Q197681), Malagasy (mg) (mg, Q793), East Barito (Q270131), Barito (Q248934), Dayak (Q305774), Q31955 (Q31955), Sundic (Q11618103), Q2016217 (Q2016217)
Skipping inheritance from	[msr]	rsl	from	Mongolian Sign Language (msr) (msr, Q391549), Russian Sign Language (rsl) (rsl, Q1321), Q550192 (Q550192)
Skipping inheritance from	[mt]	ar	from	Maltese (mt) (mt, Q916), Q8518936 (Q8518936), Maghrebi Arabic (Q119479), Arabic (ar) (ar, Q1395), Semitic [Other] (sem) (sem, Q3404), Afro-Asiatic [Other] (afa) (afa, Q2526), Q2016217 (Q2016217); Maltese (mt) (mt, Q916), Q8518936 (Q8518936), Maghrebi Arabic (Q119479), Arabic (ar) (ar, Q1395), Semitic [Other] (sem) (sem, Q3404), Afro-Asiatic [Other] (afa) (afa, Q2526), Q27631 (Q27631); Maltese (mt) (mt, Q916), Q8538012 (Q8538012)
Skipping inheritance from	[mtm]	mtm	from	Mator (mtm) (mtm, Q3375), Mator (mtm) (mtm, Q2066941), Samoyedic languages (syd) (syd, Q3400), Uralic languages (urj) (urj, Q3411), Q2016217 (Q2016217); Mator (mtm) (mtm, Q3375), Mator (mtm) (mtm, Q2066941), Samoyedic languages (syd) (syd, Q3400), Uralic languages (urj) (urj, Q3411), Ural–Altaic (Q72865), Q20657 (Q20657); Mator (mtm) (mtm, Q3375), Mator (mtm) (mtm, Q2066941), Samoyedic languages (syd) (syd, Q3400), Uralic languages (urj) (urj, Q3411), Q77186 (Q77186)
Skipping inheritance from	[mtr]	mwr	from	Mewari (mtr) (mtr, Q299285), Marwari (mwr) (mwr, Q5631), Rajasthani (raj) (raj, Q1319), Central Indo-Aryan (Q1097918), Indic [Other] (inc) (inc, Q3357), Q1560938 (Q1560938); Mewari (mtr) (mtr, Q299285), Marwari (mwr) (mwr, Q5631), Rajasthani (raj) (raj, Q1319), Central Indo-Aryan (Q1097918), Indic [Other] (inc) (inc, Q3357), Indo-Iranian languages (iir) (iir, Q3351), Q9879175 (Q9879175); Mewari (mtr) (mtr, Q299285), Marwari (mwr) (mwr, Q5631), Rajasthani (raj) (raj, Q1319), Central Indo-Aryan (Q1097918), Indic [Other] (inc) (inc, Q3357), Indo-Iranian languages (iir) (iir, Q3351), Indo-European [Other] (ine) (ine, Q1986), Q2016217 (Q2016217); Mewari (mtr) (mtr, Q299285), Marwari (mwr) (mwr, Q5631), Rajasthani (raj) (raj, Q1319), Central Indo-Aryan (Q1097918), Indic [Other] (inc) (inc, Q3357), Indo-Iranian languages (iir) (iir, Q3351), Indo-European [Other] (ine) (ine, Q1986), Q27631 (Q27631); Mewari (mtr) (mtr, Q299285), Marwari (mwr) (mwr, Q5631), Rajasthani (raj) (raj, Q1319), Central Indo-Aryan (Q1097918), Indic [Other] (inc) (inc, Q3357), Indo-Iranian languages (iir) (iir, Q3351), Indo-European [Other] (ine) (ine, Q1986), Q77186 (Q77186); Mewari (mtr) (mtr, Q299285), Marwari (mwr) (mwr, Q5631), Rajasthani (raj) (raj, Q1319), Indic [Other] (inc) (inc, Q3357), Q1560938 (Q1560938); Mewari (mtr) (mtr, Q299285), Marwari (mwr) (mwr, Q5631), Rajasthani (raj) (raj, Q1319), Indic [Other] (inc) (inc, Q3357), Indo-Iranian languages (iir) (iir, Q3351), Q9879175 (Q9879175); Mewari (mtr) (mtr, Q299285), Marwari (mwr) (mwr, Q5631), Rajasthani (raj) (raj, Q1319), Indic [Other] (inc) (inc, Q3357), Indo-Iranian languages (iir) (iir, Q3351), Indo-European [Other] (ine) (ine, Q1986), Q2016217 (Q2016217); Mewari (mtr) (mtr, Q299285), Marwari (mwr) (mwr, Q5631), Rajasthani (raj) (raj, Q1319), Indic [Other] (inc) (inc, Q3357), Indo-Iranian languages (iir) (iir, Q3351), Indo-European [Other] (ine) (ine, Q1986), Q27631 (Q27631); Mewari (mtr) (mtr, Q299285), Marwari (mwr) (mwr, Q5631), Rajasthani (raj) (raj, Q1319), Indic [Other] (inc) (inc, Q3357), Indo-Iranian languages (iir) (iir, Q3351), Indo-European [Other] (ine) (ine, Q1986), Q77186 (Q77186)
Skipping inheritance from	[mtr]	raj	from	Mewari (mtr) (mtr, Q299285), Marwari (mwr) (mwr, Q5631), Rajasthani (raj) (raj, Q1319), Central Indo-Aryan (Q1097918), Indic [Other] (inc) (inc, Q3357), Q1560938 (Q1560938); Mewari (mtr) (mtr, Q299285), Marwari (mwr) (mwr, Q5631), Rajasthani (raj) (raj, Q1319), Central Indo-Aryan (Q1097918), Indic [Other] (inc) (inc, Q3357), Indo-Iranian languages (iir) (iir, Q3351), Q9879175 (Q9879175); Mewari (mtr) (mtr, Q299285), Marwari (mwr) (mwr, Q5631), Rajasthani (raj) (raj, Q1319), Central Indo-Aryan (Q1097918), Indic [Other] (inc) (inc, Q3357), Indo-Iranian languages (iir) (iir, Q3351), Indo-European [Other] (ine) (ine, Q1986), Q2016217 (Q2016217); Mewari (mtr) (mtr, Q299285), Marwari (mwr) (mwr, Q5631), Rajasthani (raj) (raj, Q1319), Central Indo-Aryan (Q1097918), Indic [Other] (inc) (inc, Q3357), Indo-Iranian languages (iir) (iir, Q3351), Indo-European [Other] (ine) (ine, Q1986), Q27631 (Q27631); Mewari (mtr) (mtr, Q299285), Marwari (mwr) (mwr, Q5631), Rajasthani (raj) (raj, Q1319), Central Indo-Aryan (Q1097918), Indic [Other] (inc) (inc, Q3357), Indo-Iranian languages (iir) (iir, Q3351), Indo-European [Other] (ine) (ine, Q1986), Q77186 (Q77186); Mewari (mtr) (mtr, Q299285), Marwari (mwr) (mwr, Q5631), Rajasthani (raj) (raj, Q1319), Indic [Other] (inc) (inc, Q3357), Q1560938 (Q1560938); Mewari (mtr) (mtr, Q299285), Marwari (mwr) (mwr, Q5631), Rajasthani (raj) (raj, Q1319), Indic [Other] (inc) (inc, Q3357), Indo-Iranian languages (iir) (iir, Q3351), Q9879175 (Q9879175); Mewari (mtr) (mtr, Q299285), Marwari (mwr) (mwr, Q5631), Rajasthani (raj) (raj, Q1319), Indic [Other] (inc) (inc, Q3357), Indo-Iranian languages (iir) (iir, Q3351), Indo-European [Other] (ine) (ine, Q1986), Q2016217 (Q2016217); Mewari (mtr) (mtr, Q299285), Marwari (mwr) (mwr, Q5631), Rajasthani (raj) (raj, Q1319), Indic [Other] (inc) (inc, Q3357), Indo-Iranian languages (iir) (iir, Q3351), Indo-European [Other] (ine) (ine, Q1986), Q27631 (Q27631); Mewari (mtr) (mtr, Q299285), Marwari (mwr) (mwr, Q5631), Rajasthani (raj) (raj, Q1319), Indic [Other] (inc) (inc, Q3357), Indo-Iranian languages (iir) (iir, Q3351), Indo-European [Other] (ine) (ine, Q1986), Q77186 (Q77186)
Skipping inheritance from	[mui]	ms	from	Musi (mui) (mui, Q61566), Music (Q11095222), Malayic (Q66262), Malayo-Polynesian languages (poz) (poz, Q14315), Austronesian [Other] (map) (map, Q4922), Sino-Austronesian (Q752474), Q2016217 (Q2016217); Musi (mui) (mui, Q61566), Music (Q11095222), Malayic (Q66262), Malayo-Polynesian languages (poz) (poz, Q14315), Austronesian [Other] (map) (map, Q4922), Austric (Q78378), Q2016217 (Q2016217); Musi (mui) (mui, Q61566), Music (Q11095222), Malayic (Q66262), Malayo-Polynesian languages (poz) (poz, Q14315), Austronesian [Other] (map) (map, Q4922), Austro-Tai (Q78381), Q2016217 (Q2016217); Musi (mui) (mui, Q61566), Malay (ms) (ms, Q923), Malayan (Q345083), Malayic (Q66262), Malayo-Polynesian languages (poz) (poz, Q14315), Austronesian [Other] (map) (map, Q4922), Sino-Austronesian (Q752474), Q2016217 (Q2016217); Musi (mui) (mui, Q61566), Malay (ms) (ms, Q923), Malayan (Q345083), Malayic (Q66262), Malayo-Polynesian languages (poz) (poz, Q14315), Austronesian [Other] (map) (map, Q4922), Austric (Q78378), Q2016217 (Q2016217); Musi (mui) (mui, Q61566), Malay (ms) (ms, Q923), Malayan (Q345083), Malayic (Q66262), Malayo-Polynesian languages (poz) (poz, Q14315), Austronesian [Other] (map) (map, Q4922), Austro-Tai (Q78381), Q2016217 (Q2016217)
Skipping inheritance from	[muq]	hmn	from	Eastern Xiangxi Miao (muq) (muq, Q2743137), Q726801 (Q726801), Hmong (hmn) (hmn, Q904077), Hmong-Mien languages (hmx) (hmx, Q3332), Q2016217 (Q2016217)
Skipping inheritance from	[mut]	gon	from	Western Muria (mut) (mut, Q1295288), Muria (Q693849), Gondi (gon) (gon, Q177536), Gondi (Q5563981), Gondi-Kui (Q1263161), South-Central Dravidian (Q1263397), South Dravidian (Q12888661), Dravidian [Other] (dra) (dra, Q3331), Q2016217 (Q2016217); Western Muria (mut) (mut, Q1295288), Muria (Q693849), Gondi (gon) (gon, Q177536), Gondi (Q5563981), Gondi-Kui (Q1263161), South-Central Dravidian (Q1263397), South Dravidian (Q12888661), Dravidian [Other] (dra) (dra, Q3331), Q27631 (Q27631); Western Muria (mut) (mut, Q1295288), Muria (Q693849), Gondi (gon) (gon, Q177536), Gondi (Q5563981), Gondi-Kui (Q1263161), South-Central Dravidian (Q1263397), Dravidian [Other] (dra) (dra, Q3331), Q2016217 (Q2016217); Western Muria (mut) (mut, Q1295288), Muria (Q693849), Gondi (gon) (gon, Q177536), Gondi (Q5563981), Gondi-Kui (Q1263161), South-Central Dravidian (Q1263397), Dravidian [Other] (dra) (dra, Q3331), Q27631 (Q27631)
Skipping inheritance from	[mvf]	mn	from	Peripheral Mongolian (mvf) (mvf, Q332065), Mongolian (mn) (mn, Q924), Mongolian languages (xgn) (xgn, Q3375), Altaic [Other] (tut) (tut, Q3784), Q27631 (Q27631); Peripheral Mongolian (mvf) (mvf, Q332065), Mongolian (mn) (mn, Q924), Mongolian languages (xgn) (xgn, Q3375), Altaic [Other] (tut) (tut, Q3784), Ural–Altaic (Q72865), Q20657 (Q20657); Peripheral Mongolian (mvf) (mvf, Q332065), Mongolian (mn) (mn, Q924), Mongolian languages (xgn) (xgn, Q3375), Altaic [Other] (tut) (tut, Q3784), Q9879175 (Q9879175)
Skipping inheritance from	[mwk]	man	from	Kita Maninkakan (mwk) (mwk, Q301552), Mandingo (man) (man, Q3577), Mande languages (dmn) (dmn, Q3368), Niger-Kordofanian [Other] (nic) (nic, Q3383), Q2016217 (Q2016217)
Skipping inheritance from	[mwr]	raj	from	Marwari (mwr) (mwr, Q5631), Rajasthani (raj) (raj, Q1319), Central Indo-Aryan (Q1097918), Indic [Other] (inc) (inc, Q3357), Q1560938 (Q1560938); Marwari (mwr) (mwr, Q5631), Rajasthani (raj) (raj, Q1319), Central Indo-Aryan (Q1097918), Indic [Other] (inc) (inc, Q3357), Indo-Iranian languages (iir) (iir, Q3351), Q9879175 (Q9879175); Marwari (mwr) (mwr, Q5631), Rajasthani (raj) (raj, Q1319), Central Indo-Aryan (Q1097918), Indic [Other] (inc) (inc, Q3357), Indo-Iranian languages (iir) (iir, Q3351), Indo-European [Other] (ine) (ine, Q1986), Q2016217 (Q2016217); Marwari (mwr) (mwr, Q5631), Rajasthani (raj) (raj, Q1319), Central Indo-Aryan (Q1097918), Indic [Other] (inc) (inc, Q3357), Indo-Iranian languages (iir) (iir, Q3351), Indo-European [Other] (ine) (ine, Q1986), Q27631 (Q27631); Marwari (mwr) (mwr, Q5631), Rajasthani (raj) (raj, Q1319), Central Indo-Aryan (Q1097918), Indic [Other] (inc) (inc, Q3357), Indo-Iranian languages (iir) (iir, Q3351), Indo-European [Other] (ine) (ine, Q1986), Q77186 (Q77186); Marwari (mwr) (mwr, Q5631), Rajasthani (raj) (raj, Q1319), Indic [Other] (inc) (inc, Q3357), Q1560938 (Q1560938); Marwari (mwr) (mwr, Q5631), Rajasthani (raj) (raj, Q1319), Indic [Other] (inc) (inc, Q3357), Indo-Iranian languages (iir) (iir, Q3351), Q9879175 (Q9879175); Marwari (mwr) (mwr, Q5631), Rajasthani (raj) (raj, Q1319), Indic [Other] (inc) (inc, Q3357), Indo-Iranian languages (iir) (iir, Q3351), Indo-European [Other] (ine) (ine, Q1986), Q2016217 (Q2016217); Marwari (mwr) (mwr, Q5631), Rajasthani (raj) (raj, Q1319), Indic [Other] (inc) (inc, Q3357), Indo-Iranian languages (iir) (iir, Q3351), Indo-European [Other] (ine) (ine, Q1986), Q27631 (Q27631); Marwari (mwr) (mwr, Q5631), Rajasthani (raj) (raj, Q1319), Indic [Other] (inc) (inc, Q3357), Indo-Iranian languages (iir) (iir, Q3351), Indo-European [Other] (ine) (ine, Q1986), Q77186 (Q77186)
Skipping inheritance from	[mwr]	raj	from	Marwari (mwr) (mwr, Q63335), Rajasthani (raj) (raj, Q1319), Central Indo-Aryan (Q1097918), Indic [Other] (inc) (inc, Q3357), Q1560938 (Q1560938); Marwari (mwr) (mwr, Q63335), Rajasthani (raj) (raj, Q1319), Central Indo-Aryan (Q1097918), Indic [Other] (inc) (inc, Q3357), Indo-Iranian languages (iir) (iir, Q3351), Q9879175 (Q9879175); Marwari (mwr) (mwr, Q63335), Rajasthani (raj) (raj, Q1319), Central Indo-Aryan (Q1097918), Indic [Other] (inc) (inc, Q3357), Indo-Iranian languages (iir) (iir, Q3351), Indo-European [Other] (ine) (ine, Q1986), Q2016217 (Q2016217); Marwari (mwr) (mwr, Q63335), Rajasthani (raj) (raj, Q1319), Central Indo-Aryan (Q1097918), Indic [Other] (inc) (inc, Q3357), Indo-Iranian languages (iir) (iir, Q3351), Indo-European [Other] (ine) (ine, Q1986), Q27631 (Q27631); Marwari (mwr) (mwr, Q63335), Rajasthani (raj) (raj, Q1319), Central Indo-Aryan (Q1097918), Indic [Other] (inc) (inc, Q3357), Indo-Iranian languages (iir) (iir, Q3351), Indo-European [Other] (ine) (ine, Q1986), Q77186 (Q77186); Marwari (mwr) (mwr, Q63335), Rajasthani (raj) (raj, Q1319), Indic [Other] (inc) (inc, Q3357), Q1560938 (Q1560938); Marwari (mwr) (mwr, Q63335), Rajasthani (raj) (raj, Q1319), Indic [Other] (inc) (inc, Q3357), Indo-Iranian languages (iir) (iir, Q3351), Q9879175 (Q9879175); Marwari (mwr) (mwr, Q63335), Rajasthani (raj) (raj, Q1319), Indic [Other] (inc) (inc, Q3357), Indo-Iranian languages (iir) (iir, Q3351), Indo-European [Other] (ine) (ine, Q1986), Q2016217 (Q2016217); Marwari (mwr) (mwr, Q63335), Rajasthani (raj) (raj, Q1319), Indic [Other] (inc) (inc, Q3357), Indo-Iranian languages (iir) (iir, Q3351), Indo-European [Other] (ine) (ine, Q1986), Q27631 (Q27631); Marwari (mwr) (mwr, Q63335), Rajasthani (raj) (raj, Q1319), Indic [Other] (inc) (inc, Q3357), Indo-Iranian languages (iir) (iir, Q3351), Indo-European [Other] (ine) (ine, Q1986), Q77186 (Q77186)
Skipping inheritance from	[mww]	hmn	from	Hmong Daw (mww) (mww, Q313882), Hmong (hmn) (hmn, Q904077), Hmong-Mien languages (hmx) (hmx, Q3332), Q2016217 (Q2016217)
Skipping inheritance from	[mxx]	man	from	Mahou (mxx) (mxx, Q1100433), Mandingo (man) (man, Q3577), Mande languages (dmn) (dmn, Q3368), Niger-Kordofanian [Other] (nic) (nic, Q3383), Q2016217 (Q2016217)
Skipping inheritance from	[mzj]	myq	from	Manya (mzj) (mzj, Q1100683), Forest Maninka (myq) (myq, Q3618), Mande languages (dmn) (dmn, Q3368), Niger-Kordofanian [Other] (nic) (nic, Q3383), Q2016217 (Q2016217); Manya (mzj) (mzj, Q1100683), Forest Maninka (myq) (myq, Q3618), Niger-Kordofanian [Other] (nic) (nic, Q3383), Q2016217 (Q2016217)
Skipping inheritance from	[nb]	no	from	Norwegian Bokmål (nb) (nb, Q2516), Norwegian (no) (no, Q904), North Germanic languages (gmq) (gmq, Q10608), Northwest Germanic (Q1313730), Germanic [Other] (gem) (gem, Q2120), Indo-European [Other] (ine) (ine, Q1986), Q2016217 (Q2016217); Norwegian Bokmål (nb) (nb, Q2516), Norwegian (no) (no, Q904), North Germanic languages (gmq) (gmq, Q10608), Northwest Germanic (Q1313730), Germanic [Other] (gem) (gem, Q2120), Indo-European [Other] (ine) (ine, Q1986), Q27631 (Q27631); Norwegian Bokmål (nb) (nb, Q2516), Norwegian (no) (no, Q904), North Germanic languages (gmq) (gmq, Q10608), Northwest Germanic (Q1313730), Germanic [Other] (gem) (gem, Q2120), Indo-European [Other] (ine) (ine, Q1986), Q77186 (Q77186); Norwegian Bokmål (nb) (nb, Q2516), Norwegian (no) (no, Q904), North Germanic languages (gmq) (gmq, Q10608), Germanic [Other] (gem) (gem, Q2120), Indo-European [Other] (ine) (ine, Q1986), Q2016217 (Q2016217); Norwegian Bokmål (nb) (nb, Q2516), Norwegian (no) (no, Q904), North Germanic languages (gmq) (gmq, Q10608), Germanic [Other] (gem) (gem, Q2120), Indo-European [Other] (ine) (ine, Q1986), Q27631 (Q27631); Norwegian Bokmål (nb) (nb, Q2516), Norwegian (no) (no, Q904), North Germanic languages (gmq) (gmq, Q10608), Germanic [Other] (gem) (gem, Q2120), Indo-European [Other] (ine) (ine, Q1986), Q77186 (Q77186); Norwegian Bokmål (nb) (nb, Q2516), Norwegian (no) (no, Q904), West Scandinavian (Q179257), North Germanic languages (gmq) (gmq, Q10608), Northwest Germanic (Q1313730), Germanic [Other] (gem) (gem, Q2120), Indo-European [Other] (ine) (ine, Q1986), Q2016217 (Q2016217); Norwegian Bokmål (nb) (nb, Q2516), Norwegian (no) (no, Q904), West Scandinavian (Q179257), North Germanic languages (gmq) (gmq, Q10608), Northwest Germanic (Q1313730), Germanic [Other] (gem) (gem, Q2120), Indo-European [Other] (ine) (ine, Q1986), Q27631 (Q27631); Norwegian Bokmål (nb) (nb, Q2516), Norwegian (no) (no, Q904), West Scandinavian (Q179257), North Germanic languages (gmq) (gmq, Q10608), Northwest Germanic (Q1313730), Germanic [Other] (gem) (gem, Q2120), Indo-European [Other] (ine) (ine, Q1986), Q77186 (Q77186); Norwegian Bokmål (nb) (nb, Q2516), Norwegian (no) (no, Q904), West Scandinavian (Q179257), North Germanic languages (gmq) (gmq, Q10608), Germanic [Other] (gem) (gem, Q2120), Indo-European [Other] (ine) (ine, Q1986), Q2016217 (Q2016217); Norwegian Bokmål (nb) (nb, Q2516), Norwegian (no) (no, Q904), West Scandinavian (Q179257), North Germanic languages (gmq) (gmq, Q10608), Germanic [Other] (gem) (gem, Q2120), Indo-European [Other] (ine) (ine, Q1986), Q27631 (Q27631); Norwegian Bokmål (nb) (nb, Q2516), Norwegian (no) (no, Q904), West Scandinavian (Q179257), North Germanic languages (gmq) (gmq, Q10608), Germanic [Other] (gem) (gem, Q2120), Indo-European [Other] (ine) (ine, Q1986), Q77186 (Q77186)
Skipping inheritance from	[nba]	lch	from	Nyemba (nba) (nba, Q334665), Luchazi (lch) (lch, Q326514), Chokwe–Luchazi (Q333927), Njila (Q11652704), Central-Western Bantu (Q11648714), Bantu [Other] (bnt) (bnt, Q3314), Southern Bantoid (Q318315), Bantoid (Q80699), Benue–Congo (Q3325), Niger-Kordofanian [Other] (nic) (nic, Q3383), Q2016217 (Q2016217); Nyemba (nba) (nba, Q334665), Luchazi (lch) (lch, Q326514), Chokwe–Luchazi (Q333927), Njila (Q11652704), Central-Western Bantu (Q11648714), Bantu [Other] (bnt) (bnt, Q3314), Southern Bantoid (Q318315), Bantoid (Q80699), Benue–Congo (Q3325), Volta–Congo (Q3722), Atlantic-Congo languages (alv) (alv, Q77112), Niger-Kordofanian [Other] (nic) (nic, Q3383), Q2016217 (Q2016217)
Skipping inheritance from	[ndq]	umb	from	Ndombe (ndq) (ndq, Q698379), Umbundu (umb) (umb, Q3698), Njila (Q11652704), Central-Western Bantu (Q11648714), Bantu [Other] (bnt) (bnt, Q3314), Southern Bantoid (Q318315), Bantoid (Q80699), Benue–Congo (Q3325), Niger-Kordofanian [Other] (nic) (nic, Q3383), Q2016217 (Q2016217); Ndombe (ndq) (ndq, Q698379), Umbundu (umb) (umb, Q3698), Njila (Q11652704), Central-Western Bantu (Q11648714), Bantu [Other] (bnt) (bnt, Q3314), Southern Bantoid (Q318315), Bantoid (Q80699), Benue–Congo (Q3325), Volta–Congo (Q3722), Atlantic-Congo languages (alv) (alv, Q77112), Niger-Kordofanian [Other] (nic) (nic, Q3383), Q2016217 (Q2016217)
Skipping inheritance from	[neo]	hmn	from	Ná-Meo (neo) (neo, Q1597729), Hmu (Q587371), Hmong (hmn) (hmn, Q904077), Hmong-Mien languages (hmx) (hmx, Q3332), Q2016217 (Q2016217)
Skipping inheritance from	[nga]	gba	from	Ngbaka (nga) (nga, Q3602), Gbaya (gba) (gba, Q309998), Gbaya-Manza-Ngbaka (Q2549451), Volta–Congo (Q3722), Atlantic-Congo languages (alv) (alv, Q77112), Niger-Kordofanian [Other] (nic) (nic, Q3383), Q2016217 (Q2016217); Ngbaka (nga) (nga, Q3602), Gbaya (gba) (gba, Q309998), Ubangian (Q3393), Adamawa–Ubangi (Q35153), Volta–Congo (Q3722), Atlantic-Congo languages (alv) (alv, Q77112), Niger-Kordofanian [Other] (nic) (nic, Q3383), Q2016217 (Q2016217)
Skipping inheritance from	[ngg]	gba	from	Ngbaka Manza (ngg) (ngg, Q1103331), Gbaya (gba) (gba, Q309998), Gbaya-Manza-Ngbaka (Q2549451), Volta–Congo (Q3722), Atlantic-Congo languages (alv) (alv, Q77112), Niger-Kordofanian [Other] (nic) (nic, Q3383), Q2016217 (Q2016217); Ngbaka Manza (ngg) (ngg, Q1103331), Gbaya (gba) (gba, Q309998), Ubangian (Q3393), Adamawa–Ubangi (Q35153), Volta–Congo (Q3722), Atlantic-Congo languages (alv) (alv, Q77112), Niger-Kordofanian [Other] (nic) (nic, Q3383), Q2016217 (Q2016217)
Skipping inheritance from	[niq]	kln	from	Nandi (niq) (niq, Q695659), Kalenjin (kln) (kln, Q63722), Southern Nilotic (Q155241), Nilotic (Q51340), Eastern Sudanic languages (sdv) (sdv, Q203614), Nilo-Saharan [Other] (ssa) (ssa, Q3370), Q2016217 (Q2016217)
Skipping inheritance from	[njz]	njz	from	Nyishi (njz) (njz, Q5687), Nyishi (njz) (njz, Q1295296), Tani (Q321753), Tibeto-Burman languages (tbq) (tbq, Q3406), Sino-Tibetan [Other] (sit) (sit, Q4596), Dené–Caucasian (Q50796), Q1737690 (Q1737690); Nyishi (njz) (njz, Q5687), Nyishi (njz) (njz, Q1295296), Tani (Q321753), Tibeto-Burman languages (tbq) (tbq, Q3406), Sino-Tibetan [Other] (sit) (sit, Q4596), Sino-Austronesian (Q752474), Q2016217 (Q2016217); Nyishi (njz) (njz, Q5687), Nyishi (njz) (njz, Q1295296), Tani (Q321753), Tibeto-Burman languages (tbq) (tbq, Q3406), Sino-Tibetan [Other] (sit) (sit, Q4596), Sino-Tibetan-Indo-European (Q9769070), Q2016217 (Q2016217); Nyishi (njz) (njz, Q5687), Nyishi (njz) (njz, Q1295296), Tani (Q321753), Tibeto-Burman languages (tbq) (tbq, Q3406), Sino-Tibetan [Other] (sit) (sit, Q4596), Q9879175 (Q9879175); Nyishi (njz) (njz, Q5687), Tani (Q321753), Tibeto-Burman languages (tbq) (tbq, Q3406), Sino-Tibetan [Other] (sit) (sit, Q4596), Dené–Caucasian (Q50796), Q1737690 (Q1737690); Nyishi (njz) (njz, Q5687), Tani (Q321753), Tibeto-Burman languages (tbq) (tbq, Q3406), Sino-Tibetan [Other] (sit) (sit, Q4596), Sino-Austronesian (Q752474), Q2016217 (Q2016217); Nyishi (njz) (njz, Q5687), Tani (Q321753), Tibeto-Burman languages (tbq) (tbq, Q3406), Sino-Tibetan [Other] (sit) (sit, Q4596), Sino-Tibetan-Indo-European (Q9769070), Q2016217 (Q2016217); Nyishi (njz) (njz, Q5687), Tani (Q321753), Tibeto-Burman languages (tbq) (tbq, Q3406), Sino-Tibetan [Other] (sit) (sit, Q4596), Q9879175 (Q9879175)
Skipping inheritance from	[nkn]	mck	from	Nkangala (nkn) (nkn, Q1096229), Mbunda (mck) (mck, Q3417), Chokwe–Luchazi (Q333927), Njila (Q11652704), Central-Western Bantu (Q11648714), Bantu [Other] (bnt) (bnt, Q3314), Southern Bantoid (Q318315), Bantoid (Q80699), Benue–Congo (Q3325), Niger-Kordofanian [Other] (nic) (nic, Q3383), Q2016217 (Q2016217); Nkangala (nkn) (nkn, Q1096229), Mbunda (mck) (mck, Q3417), Chokwe–Luchazi (Q333927), Njila (Q11652704), Central-Western Bantu (Q11648714), Bantu [Other] (bnt) (bnt, Q3314), Southern Bantoid (Q318315), Bantoid (Q80699), Benue–Congo (Q3325), Volta–Congo (Q3722), Atlantic-Congo languages (alv) (alv, Q77112), Niger-Kordofanian [Other] (nic) (nic, Q3383), Q2016217 (Q2016217)
Skipping inheritance from	[nmj]	gba	from	Ngombe [Central African Republic] (nmj) (nmj, Q391394), Gbaya (gba) (gba, Q309998), Gbaya-Manza-Ngbaka (Q2549451), Volta–Congo (Q3722), Atlantic-Congo languages (alv) (alv, Q77112), Niger-Kordofanian [Other] (nic) (nic, Q3383), Q2016217 (Q2016217); Ngombe [Central African Republic] (nmj) (nmj, Q391394), Gbaya (gba) (gba, Q309998), Ubangian (Q3393), Adamawa–Ubangi (Q35153), Volta–Congo (Q3722), Atlantic-Congo languages (alv) (alv, Q77112), Niger-Kordofanian [Other] (nic) (nic, Q3383), Q2016217 (Q2016217)
